,Restaurant Name,Food Name,Total Fat Amount,Total Fat Unit,Cholesterol Amount,Cholesterol Unit,Sodium Amount,Sodium Unit,Total Carbohydrate Amount,Total Carbohydrate Unit,Protein Amount,Protein Unit,Saturated Fat Amount,Saturated Fat Unit,Trans Fat Amount,Trans Fat Unit,Dietary Fiber Amount,Dietary Fiber Unit,Sugars Amount,Sugars Unit
614,pizza express,christmas special leggera pizza porchetta,22,g,0,mg,0,g,68,g,34,g,8,g,0,g,7,g,4,g
615,pizza express,christmas special leggera pizza tre formaggi,17,g,0,mg,0,g,67,g,27,g,9,g,0,g,10,g,6,g
616,pizza express,christmas special leggera pizza vegan zucca,26,g,0,mg,0,g,82,g,17,g,3,g,0,g,13,g,10,g
617,pizza express,christmas special millionaires fudge cake with ice cream,23,g,0,mg,0,g,81,g,8,g,11,g,0,g,2,g,58,g
618,pizza express,christmas special mince pie,6,g,0,mg,0,g,34,g,2,g,3,g,0,g,9,g,24,g
619,pizza express,christmas special piccolo snow ball dough ball,1,g,0,mg,0,g,26,g,5,g,0,g,0,g,1,g,2,g
620,pizza express,christmas special piccolo snow ball dough ball dip fruit coulis,1,g,0,mg,0,g,5,g,1,g,0,g,0,g,1,g,5,g
621,pizza express,christmas special piccolo snow ball dough ball dip vanilla icing,4,g,0,mg,0,g,11,g,1,g,2,g,0,g,1,g,9,g
622,pizza express,christmas special pigs in blanket,33,g,0,mg,0,g,16,g,25,g,12,g,0,g,4,g,11,g
623,pizza express,christmas special romana pizza porchetta,57,g,0,mg,0,g,128,g,83,g,26,g,0,g,10,g,13,g
624,pizza express,christmas special romana pizza quattro formaggi,42,g,0,mg,0,g,124,g,63,g,23,g,0,g,11,g,13,g
625,pizza express,christmas special romana pizza vegan zucca,38,g,0,mg,0,g,168,g,28,g,4.5,g,0,g,14,g,26,g
626,pizza express,christmas special rosemary and chutney bread,11,g,0,mg,0,g,70,g,10,g,4,g,0,g,5,g,20,g
627,pizza express,christmas special sharing plate,59,g,0,mg,0,g,87,g,46,g,15,g,0,g,7,g,14,g
628,pizza express,christmas special snow ball dough ball,1.5,g,0,mg,0,g,50,g,9,g,0,g,0,g,3,g,4,g
629,pizza express,christmas special snow ball dough ball dip chocolate sauce,1,g,0,mg,0,g,22,g,1,g,1,g,0,g,1,g,19,g
630,pizza express,christmas special snow ball dough ball dip fruit coulis,1,g,0,mg,0,g,9,g,1,g,0,g,0,g,1,g,9,g
631,pizza express,christmas special snow ball dough ball dip vanilla icing,7,g,0,mg,0,g,21,g,1,g,4,g,0,g,1,g,17,g
632,pizza express,christmas special snow ball dough ball doppio,3,g,0,mg,0,g,94,g,18,g,0.5,g,0,g,4,g,7,g
633,pizza express,classic house dressing,20,g,0,mg,0,g,2,g,1,g,2.5,g,0,g,0,g,1,g
634,pizza express,classic pizza american,40,g,0,mg,0,g,122,g,41,g,16,g,0,g,6,g,11,g
635,pizza express,classic pizza fiorentina,31,g,0,mg,1800,g,108,g,52,g,13,g,0,g,11,g,8,g
636,pizza express,classic pizza giardiniera vegan,28,g,0,mg,2280,g,131,g,25,g,9,g,0,g,12,g,14,g
637,pizza express,classic pizza la reine,29,g,0,mg,1840,g,109,g,47,g,11,g,0,g,8,g,10,g
638,pizza express,classic pizza margherita,25,g,0,mg,1560,g,112,g,38,g,10,g,0,g,7,g,13,g
639,pizza express,classic pizza margherita vegan,19,g,0,mg,0,g,119,g,21,g,8,g,0,g,9,g,11,g
640,pizza express,classic pizza sloppy giuseppe,26,g,0,mg,1880,g,115,g,45,g,12,g,0,g,11,g,14,g
641,pizza express,classic pizza veneziana,30,g,0,mg,1680,g,120,g,42,g,11,g,0,g,10,g,18,g
642,pizza express,classic pizza veneziana vegan,23,g,0,mg,0,g,132,g,23,g,9,g,0,g,11,g,21,g
643,pizza express,coleslaw pizza express,33,g,0,mg,320,g,5,g,2,g,2.5,g,0,g,3,g,0,g
644,pizza express,coppa gelato chocolate chocolate straw,10,g,0,mg,80,g,33,g,6,g,7,g,0,g,3,g,28,g
645,pizza express,coppa gelato salted caramel chocolate straw,15,g,0,mg,360,g,34,g,5,g,9,g,0,g,0,g,32,g
646,pizza express,coppa gelato strawberry chocolate straw,5,g,0,mg,0,g,40,g,2,g,3.5,g,0,g,1,g,34,g
647,pizza express,coppa gelato vanilla chocolate straw,10,g,0,mg,120,g,33,g,6,g,7,g,0,g,1,g,33,g
648,pizza express,dough balls,22,g,0,mg,640,g,40,g,8,g,13,g,0,g,3,g,3,g
649,pizza express,dough balls doppio,43,g,0,mg,1360,g,88,g,19,g,14,g,0,g,5,g,9,g
650,pizza express,dough balls without butter,1.5,g,0,mg,0,g,46,g,9,g,0,g,0,g,3,g,3,g
651,pizza express,dough sticks,2.5,g,0,mg,0,g,48,g,10,g,0,g,0,g,2,g,4,g
652,pizza express,fruit coulis,0,g,0,mg,0,g,6,g,0,g,0,g,0,g,0,g,6,g
653,pizza express,garlic bread with mozzarella,10,g,0,mg,640,g,49,g,15,g,4.5,g,0,g,4,g,4,g
654,pizza express,gluten free dough balls with garlic butter,19,g,0,mg,40,g,47,g,1,g,10,g,0,g,4,g,2,g
655,pizza express,grand chicken caesar salad with dressing,40,g,0,mg,0,g,20,g,48,g,8,g,0,g,3,g,4,g
656,pizza express,grand chicken caesar salad with dressing and dough sticks,42,g,0,mg,0,g,68,g,58,g,8,g,0,g,5,g,8,g
657,pizza express,grand chicken caesar salad without dressing,25,g,0,mg,2120,g,17,g,47,g,6,g,0,g,2,g,2,g
658,pizza express,haloumi bites,24,g,0,mg,0,g,27,g,15,g,10,g,0,g,2,g,1,g
659,pizza express,honey mustard dressing,18,g,0,mg,0,g,8,g,1,g,1,g,0,g,1,g,8,g
660,pizza express,honeycombe cream cake slice,37,g,0,mg,440,g,55,g,5,g,19,g,0,g,1,g,37,g
661,pizza express,king prawns with spicy nduja,16,g,0,mg,0,g,29,g,17,g,4.5,g,0,g,3,g,6,g
662,pizza express,lasagna classica,42,g,0,mg,1560,g,43,g,37,g,23,g,0,g,7,g,11,g
663,pizza express,leggera peperonata,16,g,0,mg,0,g,91,g,12,g,2,g,0,g,8,g,16,g
664,pizza express,leggera sorbet cocconut sorbet,6,g,0,mg,0,g,36,g,1,g,5,g,0,g,0,g,29,g
665,pizza express,leggera sorbet raspberry sorbet,0.5,g,0,mg,0,g,28,g,1,g,0,g,0,g,1,g,28,g
666,pizza express,leggera superfood salad,15,g,0,mg,640,g,28,g,14,g,2,g,0,g,16,g,14,g
667,pizza express,lemon and herbs chicken wings,38,g,0,mg,0,g,2,g,52,g,8,g,0,g,0,g,2,g
668,pizza express,light house dressing,14,g,0,mg,0,g,2,g,0,g,2,g,0,g,0,g,2,g
669,pizza express,lotus biscoff cheesecake,23,g,0,mg,0,g,25,g,3,g,10,g,0,g,1,g,15,g
670,pizza express,mixed salad with house dressing,19,g,0,mg,0,g,5,g,2,g,2.5,g,0,g,3,g,4,g
671,pizza express,mixed salad without dressing,5,g,0,mg,350,g,4,g,2,g,1,g,0,g,1,g,3,g
672,pizza express,nicoise salad with dressing,41,g,0,mg,0,g,7,g,40,g,6,g,0,g,2,g,5,g
673,pizza express,nicoise salad with dressing and dough sticks,44,g,0,mg,0,g,56,g,50,g,7,g,0,g,5,g,9,g
674,pizza express,nicoise salad without dressing,21,g,0,mg,1800,g,5,g,39,g,3.5,g,0,g,2,g,3,g
675,pizza express,olives marinate,14,g,0,mg,1120,g,1,g,1,g,1.5,g,0,g,3,g,0,g
676,pizza express,piccolo dough balls no dips no salad,0,g,0,mg,0,g,12,g,2,g,0,g,0,g,1,g,1,g
677,pizza express,piccolo dough balls with houmous with salad,8,g,0,mg,0,g,24,g,7,g,0.5,g,0,g,3,g,2,g
678,pizza express,piccolo gluten free dough,1,g,0,mg,0,g,37,g,2,g,0,g,0,g,1,g,1,g
679,pizza express,piccolo baked dough balls with balsamic and olive oil no salad,4.5,g,0,mg,0,g,24,g,5,g,0.5,g,0,g,1,g,3,g
680,pizza express,piccolo baked dough balls with butter no salad,8,g,0,mg,0,g,23,g,5,g,5,g,0,g,1,g,2,g
681,pizza express,piccolo bianca,12,g,0,mg,0,g,56,g,7,g,6,g,0,g,2,g,3,g
682,pizza express,piccolo bolognese,10,g,0,mg,0,g,53,g,14,g,3.5,g,0,g,4,g,5,g
683,pizza express,piccolo cawston apple and pear juice,0,g,0,mg,0,g,13,g,0,g,0,g,0,g,0,g,13,g
684,pizza express,piccolo cawston apple and summer berries,0,g,0,mg,0,g,12,g,1,g,0,g,0,g,0,g,11,g
685,pizza express,piccolo chocolate brownie,11,g,0,mg,0,g,25,g,3,g,6,g,0,g,2,g,20,g
686,pizza express,piccolo napoletana,5,g,0,mg,0,g,54,g,7,g,3,g,0,g,3,g,4,g
687,pizza express,piccolo pip organic fruity ice lolly,0,g,0,mg,0,g,4,g,0,g,0,g,0,g,0,g,4,g
688,pizza express,piccolo pip organic rainbow ice lolly,0,g,0,mg,0,g,5,g,0,g,0,g,0,g,0,g,4,g
689,pizza express,piccolo pizza american,18,g,0,mg,0,g,55,g,27,g,9,g,0,g,8,g,6,g
690,pizza express,piccolo pizza la reine,14,g,0,mg,0,g,64,g,29,g,7,g,0,g,7,g,7,g
691,pizza express,piccolo pizza margherita,11,g,0,mg,0,g,63,g,21,g,7,g,0,g,5,g,7,g
692,pizza express,piccolo pizza pollo,11,g,0,mg,0,g,59,g,29,g,6,g,0,g,3,g,7,g
693,pizza express,piccolo pollo salad with db,9,g,0,mg,0,g,24,g,27,g,3,g,0,g,3,g,1,g
694,pizza express,piccolo pollo salad with polenta chips,17,g,0,mg,0,g,12,g,23,g,3.5,g,0,g,3,g,0,g
695,pizza express,piccolo salad to go with starter,0.5,g,0,mg,0,g,2,g,1,g,0,g,0,g,1,g,2,g
696,pizza express,piccolo sundae with chocolate sauce,4.5,g,0,mg,0,g,24,g,3,g,3,g,0,g,0,g,22,g
697,pizza express,piccolo sundae with fruit sauce,4.5,g,0,mg,0,g,20,g,3,g,3,g,0,g,0,g,18,g
698,pizza express,polenta chips,27,g,0,mg,1200,g,43,g,7,g,2.5,g,0,g,8,g,5,g
699,pizza express,pollo pesto gf,58,g,0,mg,1200,g,90,g,49,g,23,g,0,g,3,g,7,g
700,pizza express,pollo salad with dressing,46,g,0,mg,0,g,25,g,43,g,13,g,0,g,4,g,5,g
701,pizza express,pollo salad with dressing and dough sticks,49,g,0,mg,0,g,73,g,53,g,14,g,0,g,6,g,9,g
702,pizza express,pollo salad without dressing,26,g,0,mg,1680,g,22,g,42,g,11,g,0,g,4,g,12,g
703,pizza express,roasted tomatoes,3.5,g,0,mg,200,g,6,g,1,g,0,g,0,g,3,g,6,g
704,pizza express,romana extra thin base pollo american,18.5,g,0,mg,1148,g,49.5,g,25.9,g,7.3,g,0,g,5.1,g,8.2,g
705,pizza express,romana pizza american hot,42,g,0,mg,2040,g,102,g,54,g,18,g,0,g,6,g,13,g
706,pizza express,romana pizza barbacoa,38,g,0,mg,0,g,128,g,72,g,14,g,0,g,12,g,27,g
707,pizza express,romana pizza calabrese,66,g,0,mg,0,g,109,g,54,g,30,g,0,g,14,g,18,g
708,pizza express,romana pizza diavlo,39,g,0,mg,2120,g,139,g,59,g,20,g,0,g,10,g,15,g
709,pizza express,romana pizza giardiniera vegan,34,g,0,mg,2440,g,144,g,28,g,13,g,0,g,12,g,15,g
710,pizza express,romana pizza padana,33,g,0,mg,1560,g,129,g,63,g,16,g,0,g,20,g,34,g
711,pizza express,romana pizza padana vegan,25,g,0,mg,0,g,153,g,25,g,13,g,0,g,14,g,34,g
712,pizza express,romana pizza pollo ad astra,33,g,0,mg,1800,g,142,g,67,g,13,g,0,g,9,g,22,g
713,pizza express,romana pizza pollo forza,45,g,0,mg,2000,g,129,g,79,g,16,g,0,g,8,g,21,g
714,pizza express,salted caramel profiteroles,16,g,0,mg,40,g,24,g,3,g,10,g,0,g,0,g,19,g
715,pizza express,side of cream,15,g,0,mg,0,g,1,g,0,g,9,g,0,g,0,g,1,g
716,pizza express,side of mascarpone,12,g,0,mg,0,g,1,g,1,g,9,g,0,g,0,g,1,g
717,pizza express,side of vanilla gelato,4.5,g,0,mg,0,g,15,g,3,g,3,g,0,g,0,g,15,g
718,pizza express,standard dough,3.5,g,0,mg,0,g,118,g,22,g,0.5,g,0,g,7,g,10,g
719,pizza express,superfood salad addition,9,g,0,mg,200,g,15,g,6,g,1,g,0,g,4,g,3,g
720,pizza express,tiramisu cake,15,g,0,mg,70,g,63,g,5,g,12,g,0,g,3,g,38,g
721,pizza express,vanilla cheesecake reduced fat and sugar,26,g,0,mg,0,g,30,g,7,g,14,g,0,g,1,g,20,g
722,pizza express,vegan carrot cake,16,g,0,mg,0,g,46,g,2,g,4,g,0,g,0,g,32,g
723,pizza express,vegan dough balls pestorissa,12,g,0,mg,0,g,49,g,10,g,1.5,g,0,g,4,g,5,g
724,pizza express,vegan house light dressing,30,g,0,mg,520,g,4.9,g,0.2,g,2.1,g,0,g,0.5,g,3.9,g
725,pizza express,wholemeal dough,5,g,0,mg,0,g,107,g,22,g,0.5,g,0,g,11,g,8,g
726,pizza express,wholemeal leggera pizza american,24,g,0,mg,0,g,56,g,34,g,7,g,0,g,8,g,7,g
727,pizza express,wholemeal leggera pizza american hot,19,g,0,mg,1200,g,67,g,30,g,7,g,0,g,7,g,6,g
728,pizza express,wholemeal leggera pizza barbacoa,19,g,0,mg,0,g,55,g,44,g,4.5,g,0,g,8,g,15,g
729,pizza express,wholemeal leggera pizza diavolo,23,g,0,mg,0,g,60,g,33,g,7,g,0,g,9,g,5,g
730,pizza express,wholemeal leggera pizza la reine,16,g,0,mg,0,g,61,g,32,g,3,g,0,g,8,g,3,g
731,pizza express,wholemeal leggera pizza margherita,13,g,0,mg,0,g,62,g,22,g,3,g,0,g,8,g,7,g
732,pizza express,wholemeal leggera pizza margherita vegan,16,g,0,mg,0,g,67,g,14,g,5,g,0,g,10,g,11,g
733,pizza express,wholemeal leggera pizza padana,17,g,0,mg,840,g,91,g,20,g,6,g,0,g,9,g,27,g
734,pizza express,wholemeal leggera pizza padana vegan,16,g,0,mg,0,g,93,g,19,g,5,g,0,g,12,g,31,g
735,pizza express,wholemeal leggera pizza pollo ad astra,14,g,0,mg,920,g,75,g,46,g,3.5,g,0,g,7,g,12,g
736,pizza express,wholemeal leggera pizza pollo forza,19,g,0,mg,0,g,61,g,47,g,3.5,g,0,g,10,g,6,g
737,pizza express,wholemeal leggera pizza sloppy giuseppe,14,g,0,mg,0,g,66,g,30,g,5,g,0,g,9,g,8,g
738,pizza express,wholemeal leggera pizza vegan giardiniera,21,g,0,mg,0,g,80,g,16,g,6,g,0,g,9,g,9,g
739,pizza express,wholemeal leggera pizza veneziana,16,g,0,mg,0,g,70,g,28,g,2.5,g,0,g,9,g,17,g
740,pizza express,wholemeal leggera pizza veneziana vegan,22,g,0,mg,0,g,76,g,15,g,7,g,0,g,10,g,20,g
741,pizza factory,all meat pizza large,17,g,55,mg,1080,g,29,g,22,g,8,g,0,g,2,g,2,g
742,pizza factory,all meat pizza medium,15,g,50,mg,960,g,26,g,20,g,7,g,0,g,2,g,2,g
743,pizza factory,all meat pizza mini,14,g,45,mg,900,g,24,g,19,g,6,g,0,g,1,g,2,g
744,pizza factory,all meat pizza small,15,g,50,mg,970,g,27,g,19,g,6,g,0,g,2,g,2,g
745,pizza factory,all meat pizza x large,19,g,60,mg,1190,g,32,g,25,g,8,g,0,g,2,g,2,g
746,pizza factory,antipasto salad,55,g,160,mg,2720,g,14,g,54,g,27,g,0,g,5,g,9,g
747,pizza factory,awesome sub sandwich,22,g,70,mg,2490,g,69,g,38,g,9,g,0,g,6,g,7,g
748,pizza factory,bbq chicken pizza large,6,g,20,mg,490,g,38,g,13,g,3,g,0,g,1,g,10,g
749,pizza factory,bbq chicken pizza medium,5,g,15,mg,430,g,34,g,11,g,2.5,g,0,g,1,g,9,g
750,pizza factory,bbq chicken pizza mini,5,g,15,mg,400,g,31,g,11,g,2.5,g,0,g,1,g,8,g
751,pizza factory,bbq chicken pizza small,4,g,15,mg,420,g,35,g,10,g,2.5,g,0,g,1,g,9,g
752,pizza factory,bbq chicken pizza x large,7,g,20,mg,540,g,42,g,14,g,3.5,g,0,g,1,g,11,g
753,pizza factory,bbq chicken sandwich,25,g,130,mg,3180,g,129,g,59,g,11,g,0,g,6,g,57,g
754,pizza factory,bbq chicken wings,53,g,225,mg,1320,g,3,g,34,g,10,g,0,g,0,g,2,g
755,pizza factory,blue cheese dressing,12,g,5,mg,340,g,2,g,1,g,3.5,g,0,g,0,g,1,g
756,pizza factory,breadstix,2,g,0,mg,90,g,16,g,3,g,0.5,g,0,g,1,g,0,g
757,pizza factory,caesar dressing,18,g,5,mg,290,g,1,g,1,g,3,g,0,g,0,g,0,g
758,pizza factory,caesar salad,58,g,80,mg,2130,g,48,g,16,g,14,g,0,g,4,g,7,g
759,pizza factory,canadian bacon sandwich,29,g,110,mg,3050,g,66,g,54,g,13,g,0,g,7,g,6,g
760,pizza factory,cheese pizza large,6,g,15,mg,330,g,27,g,11,g,3,g,0,g,2,g,1,g
761,pizza factory,cheese pizza medium,4.5,g,10,mg,290,g,25,g,9,g,2.5,g,0,g,1,g,1,g
762,pizza factory,cheese pizza mini,4.5,g,10,mg,280,g,23,g,9,g,2.5,g,0,g,1,g,1,g
763,pizza factory,cheese pizza small,4,g,10,mg,280,g,25,g,9,g,2,g,0,g,1,g,1,g
764,pizza factory,cheese pizza x large,6,g,15,mg,370,g,30,g,12,g,3.5,g,0,g,2,g,2,g
765,pizza factory,cheese ravioli,30,g,150,mg,2500,g,85,g,50,g,16,g,0,g,11,g,21,g
766,pizza factory,cherry coke,0,g,0,mg,0,g,28,g,0,g,0,g,0,g,0,g,28,g
767,pizza factory,chicken caesar salad,64,g,170,mg,3020,g,50,g,50,g,15,g,0,g,4,g,7,g
768,pizza factory,chicken greek salad,64,g,120,mg,3400,g,27,g,42,g,12,g,0,g,7,g,11,g
769,pizza factory,chicken pizza large,6,g,20,mg,380,g,28,g,13,g,3,g,0,g,2,g,1,g
770,pizza factory,chicken pizza medium,5,g,15,mg,340,g,25,g,11,g,2.5,g,0,g,1,g,1,g
771,pizza factory,chicken pizza mini,5,g,15,mg,320,g,23,g,11,g,2.5,g,0,g,1,g,1,g
772,pizza factory,chicken pizza small,4,g,15,mg,330,g,25,g,11,g,2.5,g,0,g,1,g,1,g
773,pizza factory,chicken pizza x large,7,g,20,mg,430,g,31,g,15,g,3.5,g,0,g,2,g,2,g
774,pizza factory,coca cola classic,0,g,0,mg,0,g,27,g,0,g,0,g,0,g,0,g,27,g
775,pizza factory,coke zero,0,g,0,mg,0,g,0,g,0,g,0,g,0,g,0,g,0,g
776,pizza factory,diet coke,0,g,0,mg,10,g,0,g,0,g,0,g,0,g,0,g,0,g
777,pizza factory,fanta orange,0,g,0,mg,15,g,30,g,0,g,0,g,0,g,0,g,30,g
778,pizza factory,fiesta beef pizza large,8,g,20,mg,460,g,30,g,13,g,3.5,g,0,g,2,g,3,g
779,pizza factory,fiesta beef pizza medium,7,g,15,mg,400,g,27,g,11,g,3,g,0,g,2,g,2,g
780,pizza factory,fiesta beef pizza mini,7,g,15,mg,380,g,25,g,11,g,3,g,0,g,2,g,2,g
781,pizza factory,fiesta beef pizza small,6,g,15,mg,390,g,27,g,10,g,2.5,g,0,g,2,g,2,g
782,pizza factory,fiesta beef pizza x large,9,g,20,mg,510,g,33,g,14,g,4,g,0,g,2,g,3,g
783,pizza factory,fiesta chicken pizza large,7,g,15,mg,470,g,30,g,13,g,3,g,0,g,2,g,3,g
784,pizza factory,fiesta chicken pizza medium,6,g,15,mg,410,g,27,g,11,g,2.5,g,0,g,2,g,2,g
785,pizza factory,fiesta chicken pizza mini,6,g,15,mg,390,g,25,g,11,g,2.5,g,0,g,2,g,2,g
786,pizza factory,fiesta chicken pizza small,5,g,10,mg,410,g,27,g,10,g,2,g,0,g,2,g,2,g
787,pizza factory,fiesta chicken pizza x large,8,g,20,mg,520,g,33,g,14,g,3.5,g,0,g,2,g,3,g
788,pizza factory,garlic bread,14,g,0,mg,540,g,44,g,8,g,2,g,0,g,3,g,1,g
789,pizza factory,garlic cheese bread,26,g,30,mg,800,g,46,g,22,g,9,g,0,g,3,g,1,g
790,pizza factory,gold peak green tea,0,g,0,mg,5,g,22,g,0,g,0,g,0,g,0,g,21,g
791,pizza factory,gold peak iced tea sweetened,0,g,0,mg,10,g,21,g,0,g,0,g,0,g,0,g,21,g
792,pizza factory,gold peak iced tea unsweetened,0,g,0,mg,10,g,0,g,0,g,0,g,0,g,0,g,0,g
793,pizza factory,greek salad,58,g,25,mg,2500,g,25,g,8,g,11,g,0,g,7,g,11,g
794,pizza factory,hawaiian pizza large,6,g,20,mg,460,g,29,g,13,g,3.5,g,0,g,2,g,3,g
795,pizza factory,hawaiian pizza medium,5,g,15,mg,400,g,27,g,11,g,2.5,g,0,g,1,g,3,g
796,pizza factory,hawaiian pizza mini,5,g,15,mg,390,g,25,g,11,g,3,g,0,g,1,g,3,g
797,pizza factory,hawaiian pizza small,4.5,g,15,mg,400,g,27,g,11,g,2.5,g,0,g,2,g,3,g
798,pizza factory,hawaiian pizza x large,7,g,20,mg,510,g,33,g,15,g,4,g,0,g,2,g,4,g
799,pizza factory,hi c fruit punch,0,g,0,mg,10,g,28,g,0,g,0,g,0,g,0,g,28,g
800,pizza factory,hot and spicy chicken wings,47,g,235,mg,1390,g,7,g,34,g,9,g,0,g,0,g,0,g
801,pizza factory,hot tuna melt,55,g,55,mg,1600,g,65,g,43,g,15,g,0,g,6,g,5,g
802,pizza factory,italian dressing,12,g,0,mg,480,g,2,g,0,g,1.5,g,0,g,0,g,1,g
803,pizza factory,lasagna,48,g,160,mg,2990,g,46,g,73,g,26,g,0,g,8,g,16,g
804,pizza factory,mayonnaise,44,g,50,mg,300,g,0,g,0,g,6,g,0,g,0,g,0,g
805,pizza factory,meat ravioli,31,g,170,mg,2820,g,85,g,50,g,15,g,0,g,11,g,21,g
806,pizza factory,meatball sandwich,39,g,190,mg,3120,g,90,g,59,g,17,g,0,g,11,g,16,g
807,pizza factory,minute maid lemonade,0,g,0,mg,40,g,26,g,0,g,0,g,0,g,0,g,25,g
808,pizza factory,minute maid light lemonade,0,g,0,mg,0,g,1,g,0,g,0,g,0,g,0,g,0,g
809,pizza factory,mustard,2.5,g,0,mg,680,g,3,g,3,g,0,g,0,g,2,g,1,g
810,pizza factory,nestea raspberry iced tea,0,g,0,mg,10,g,16,g,0,g,0,g,0,g,0,g,15,g
811,pizza factory,oven roasted chicken wings,10,g,75,mg,650,g,4,g,15,g,3,g,0,g,0,g,0,g
812,pizza factory,pasta alfredo,111,g,370,mg,3070,g,105,g,68,g,66,g,0,g,5,g,7,g
813,pizza factory,pasta alfredo with chicken,117,g,465,mg,3960,g,107,g,102,g,67,g,0,g,5,g,7,g
814,pizza factory,pesto and sundried tomato pizza large,9,g,15,mg,270,g,28,g,12,g,3.5,g,0,g,1,g,0,g
815,pizza factory,pesto and sundried tomato pizza medium,8,g,10,mg,230,g,26,g,10,g,3,g,0,g,1,g,0,g
816,pizza factory,pesto and sundried tomato pizza mini,8,g,10,mg,230,g,23,g,10,g,3,g,0,g,1,g,0,g
817,pizza factory,pesto and sundried tomato pizza small,7,g,10,mg,230,g,26,g,9,g,2.5,g,0,g,1,g,0,g
818,pizza factory,pesto and sundried tomato pizza x large,10,g,15,mg,300,g,31,g,13,g,4,g,0,g,2,g,1,g
819,pizza factory,pibb xtra,0,g,0,mg,15,g,26,g,0,g,0,g,0,g,0,g,26,g
820,pizza factory,pizza bread with no toppings,14,g,30,mg,950,g,37,g,21,g,7,g,0,g,3,g,4,g
821,pizza factory,pizza factory special pizza large,14,g,35,mg,720,g,29,g,16,g,6,g,0,g,2,g,2,g
822,pizza factory,pizza factory special pizza medium,12,g,30,mg,640,g,26,g,14,g,5,g,0,g,2,g,2,g
823,pizza factory,pizza factory special pizza mini,11,g,30,mg,590,g,24,g,13,g,5,g,0,g,2,g,2,g
824,pizza factory,pizza factory special pizza small,11,g,30,mg,640,g,27,g,14,g,5,g,0,g,2,g,2,g
825,pizza factory,pizza factory special pizza x large,15,g,40,mg,800,g,32,g,18,g,7,g,0,g,2,g,2,g
826,pizza factory,powerade mountain blast,0,g,0,mg,50,g,15,g,0,g,0,g,0,g,0,g,15,g
827,pizza factory,ranch dressing,24,g,10,mg,440,g,2,g,2,g,5,g,0,g,0,g,2,g
828,pizza factory,regular calzone individual size,33,g,120,mg,2730,g,102,g,60,g,17,g,0,g,7,g,11,g
829,pizza factory,regular calzone large size,50,g,175,mg,4060,g,171,g,92,g,26,g,0,g,12,g,19,g
830,pizza factory,salami sandwich,60,g,165,mg,3430,g,69,g,61,g,28,g,0,g,7,g,11,g
831,pizza factory,sausage sandwich,31,g,130,mg,2830,g,80,g,55,g,14,g,0,g,11,g,14,g
832,pizza factory,spaghetti with meat sauce,22,g,70,mg,2560,g,118,g,49,g,10,g,0,g,14,g,19,g
833,pizza factory,spaghetti with meatballs,38,g,195,mg,3670,g,130,g,74,g,16,g,0,g,15,g,21,g
834,pizza factory,spinach and garlic pizza large,6,g,15,mg,350,g,30,g,12,g,3,g,0,g,2,g,2,g
835,pizza factory,spinach and garlic pizza medium,4.5,g,10,mg,300,g,27,g,10,g,2.5,g,0,g,2,g,1,g
836,pizza factory,spinach and garlic pizza mini,4.5,g,10,mg,290,g,25,g,10,g,2.5,g,0,g,2,g,1,g
837,pizza factory,spinach and garlic pizza small,4,g,10,mg,290,g,28,g,9,g,2,g,0,g,2,g,1,g
838,pizza factory,spinach and garlic pizza x large,6,g,15,mg,390,g,33,g,13,g,3.5,g,0,g,2,g,2,g
839,pizza factory,sprite,0,g,0,mg,20,g,26,g,0,g,0,g,0,g,2,g,26,g
840,pizza factory,submarine sandwich,46,g,115,mg,3200,g,71,g,47,g,20,g,0,g,7,g,10,g
841,pizza factory,taco salad,57,g,160,mg,2900,g,47,g,39,g,25,g,0,g,9,g,14,g
842,pizza factory,thousand island dressing,15,g,5,mg,290,g,8,g,0,g,2,g,0,g,0,g,8,g
843,pizza factory,tuna salad,36,g,15,mg,570,g,9,g,21,g,5,g,0,g,4,g,4,g
844,pizza factory,turkey sandwich,21,g,110,mg,1690,g,68,g,50,g,10,g,0,g,7,g,8,g
845,pizza factory,vanilla coke,0,g,0,mg,0,g,28,g,0,g,0,g,0,g,0,g,28,g
846,pizza factory,vegetarian calzone individual size,32,g,55,mg,1900,g,107,g,45,g,13,g,0,g,8,g,11,g
847,pizza factory,vegetarian calzone large size,50,g,85,mg,2980,g,178,g,73,g,20,g,0,g,14,g,19,g
848,pizza factory,vegetarian pizza large,7,g,15,mg,390,g,30,g,11,g,3,g,0,g,2,g,2,g
849,pizza factory,vegetarian pizza medium,6,g,10,mg,340,g,27,g,10,g,2.5,g,0,g,2,g,2,g
850,pizza factory,vegetarian pizza mini,6,g,10,mg,320,g,25,g,10,g,2.5,g,0,g,2,g,2,g
851,pizza factory,vegetarian pizza small,5,g,10,mg,330,g,27,g,9,g,2,g,0,g,2,g,2,g
852,pizza factory,vegetarian pizza x large,8,g,15,mg,430,g,33,g,13,g,3.5,g,0,g,2,g,3,g
853,pizza factory,white pizza large,14,g,15,mg,190,g,25,g,11,g,4.5,g,0,g,1,g,0,g
854,pizza factory,white pizza medium,12,g,10,mg,160,g,23,g,9,g,3.5,g,0,g,1,g,0,g
855,pizza factory,white pizza mini,11,g,10,mg,160,g,21,g,9,g,3.5,g,0,g,1,g,0,g
856,pizza factory,white pizza small,12,g,10,mg,150,g,23,g,8,g,3,g,0,g,1,g,0,g
857,pizza factory,white pizza x large,15,g,15,mg,220,g,28,g,12,g,5,g,0,g,1,g,0,g
858,pizza fusion,bbq chicken personal pizza,6,g,30,mg,640,g,43,g,11,g,3,g,0,g,2,g,10,g
859,pizza fusion,bbq chicken pizza,4,g,20,mg,430,g,26,g,8,g,2,g,0,g,1,g,7,g
860,pizza fusion,big kahuna personal pizza,13,g,35,mg,930,g,39,g,18,g,6,g,0,g,3,g,2,g
861,pizza fusion,big kahuna pizza,9,g,20,mg,590,g,26,g,12,g,4,g,0,g,2,g,2,g
862,pizza fusion,bruschetta personal pizza,5,g,10,mg,360,g,37,g,10,g,3,g,0,g,2,g,1,g
863,pizza fusion,bruschetta pizza,4,g,10,mg,260,g,23,g,8,g,2,g,0,g,1,g,2,g
864,pizza fusion,caesar and roasted chicken salad,21,g,40,mg,730,g,28,g,9,g,6,g,0,g,2,g,5,g
865,pizza fusion,cheese personal pizza,6,g,10,mg,460,g,35,g,10,g,3,g,0,g,2,g,2,g
866,pizza fusion,cheese pizza,5,g,10,mg,360,g,23,g,7,g,2,g,0,g,2,g,2,g
867,pizza fusion,chicken bruschetta salad,22,g,55,mg,330,g,22,g,11,g,7,g,0,g,3,g,4,g
868,pizza fusion,chocolate calzone,9,g,10,mg,170,g,30,g,5,g,3,g,0,g,1,g,9,g
869,pizza fusion,chocolate chip cookies,13,g,5,mg,210,g,33,g,4,g,5,g,0,g,3,g,13,g
870,pizza fusion,eggplant and mozzarella personal pizza,11,g,20,mg,610,g,39,g,12,g,5,g,0,g,4,g,2,g
871,pizza fusion,eggplant and mozzarella pizza,6,g,10,mg,380,g,24,g,7,g,2,g,0,g,2,g,2,g
872,pizza fusion,farmers market personal pizza,8,g,15,mg,750,g,40,g,12,g,3,g,0,g,3,g,4,g
873,pizza fusion,farmers market pizza,6,g,10,mg,500,g,25,g,9,g,2,g,0,g,2,g,3,g
874,pizza fusion,flatbread,1,g,0,mg,340,g,38,g,7,g,1,g,0,g,2,g,1,g
875,pizza fusion,founders pie personal pizza,14,g,40,mg,540,g,41,g,14,g,5,g,0,g,3,g,4,g
876,pizza fusion,founders pie pizza,7,g,20,mg,350,g,25,g,8,g,2,g,0,g,2,g,3,g
877,pizza fusion,four cheese and sundried personal pizza,7,g,25,mg,490,g,39,g,12,g,4,g,0,g,3,g,6,g
878,pizza fusion,four cheese and sundried pizza,5,g,20,mg,360,g,26,g,8,g,3,g,0,g,2,g,5,g
879,pizza fusion,fusion salad salad,8,g,0,mg,300,g,20,g,5,g,1,g,0,g,4,g,1,g
880,pizza fusion,gluten free brownies,16,g,10,mg,50,g,27,g,1,g,3,g,0,g,1,g,17,g
881,pizza fusion,greek personal pizza,11,g,15,mg,570,g,39,g,12,g,3,g,0,g,3,g,2,g
882,pizza fusion,greek pizza,7,g,10,mg,440,g,25,g,9,g,3,g,0,g,2,g,2,g
883,pizza fusion,pan roasted steak salad,26,g,55,mg,540,g,22,g,18,g,8,g,0,g,4,g,3,g
884,pizza fusion,pear and gorgonzola salad,34,g,30,mg,430,g,12,g,12,g,8,g,0,g,4,g,3,g
885,pizza fusion,pepperoni personal pizza,15,g,30,mg,720,g,37,g,17,g,6,g,0,g,2,g,2,g
886,pizza fusion,pepperoni pizza,9,g,20,mg,580,g,23,g,10,g,4,g,0,g,2,g,2,g
887,pizza fusion,portabello grill sandwich,20,g,20,mg,760,g,38,g,14,g,7,g,0,g,3,g,1,g
888,pizza fusion,roasted beet and feta salad,25,g,15,mg,600,g,19,g,8,g,5,g,0,g,4,g,3,g
889,pizza fusion,roasted chicken sandwich,14,g,55,mg,720,g,41,g,17,g,6,g,0,g,4,g,5,g
890,pizza fusion,roasted turkey sandwich,19,g,60,mg,1240,g,35,g,26,g,6,g,0,g,2,g,2,g
891,pizza fusion,sausage and tri peppers personal pizza,12,g,25,mg,790,g,39,g,15,g,5,g,0,g,3,g,2,g
892,pizza fusion,sausage and tri peppers pizza,8,g,15,mg,520,g,25,g,10,g,3,g,0,g,2,g,2,g
893,pizza fusion,side arugula salad,4,g,0,mg,290,g,1,g,1,g,1,g,0,g,0,g,0,g
894,pizza fusion,spinach and artichoke personal pizza,7,g,10,mg,700,g,41,g,12,g,3,g,0,g,4,g,3,g
895,pizza fusion,spinach and artichoke pizza,5,g,10,mg,480,g,25,g,9,g,2,g,0,g,2,g,2,g
896,pizza fusion,strawberry cheese pastry,10,g,15,mg,390,g,54,g,9,g,4,g,0,g,2,g,4,g
897,pizza fusion,stuffed portobello mushroom,11,g,5,mg,510,g,9,g,5,g,3,g,0,g,2,g,3,g
898,pizza fusion,trio of dips,11,g,10,mg,490,g,30,g,6,g,3,g,0,g,3,g,1,g
899,pizza fusion,tuscan steak and gorgonzola personal pizza,14,g,35,mg,810,g,42,g,19,g,5,g,0,g,4,g,2,g
900,pizza fusion,tuscan steak and gorgonzola pizza,8,g,20,mg,520,g,26,g,11,g,3,g,0,g,3,g,2,g
901,pizza fusion,tuscan steak sandwich,23,g,70,mg,860,g,39,g,28,g,10,g,0,g,3,g,1,g
902,pizza fusion,very vegan personal pizza,15,g,0,mg,540,g,41,g,9,g,1,g,0,g,4,g,2,g
903,pizza fusion,very vegan pizza,8,g,0,mg,410,g,27,g,6,g,1,g,0,g,3,g,2,g
904,pizza king,10 inch pizza topping anchovie filets,3,g,25,mg,1250,g,0,g,7,g,0,g,0,g,0,g,0,g
905,pizza king,10 inch pizza topping bacon pieces,12,g,60,mg,650,g,0,g,12,g,6,g,0,g,0,g,0,g
906,pizza king,10 inch pizza topping bar b q sauce,0,g,0,mg,1040,g,43,g,0,g,0,g,0,g,0,g,42,g
907,pizza king,10 inch pizza topping black olives,11,g,0,mg,560,g,5,g,0,g,0,g,0,g,0,g,0,g
