,Restaurant Name,Food Name,Total Fat Amount,Total Fat Unit,Cholesterol Amount,Cholesterol Unit,Sodium Amount,Sodium Unit,Total Carbohydrate Amount,Total Carbohydrate Unit,Protein Amount,Protein Unit,Saturated Fat Amount,Saturated Fat Unit,Trans Fat Amount,Trans Fat Unit,Dietary Fiber Amount,Dietary Fiber Unit,Sugars Amount,Sugars Unit
0,pizza bolis,8 inch sub add provolone cheese,12,g,30,mg,360,g,0,g,10,g,6,g,0,g,0,g,0,g
1,pizza bolis,8 inch sub add raw onions,0,g,0,mg,0,g,3,g,0,g,0,g,0,g,1,g,3,g
2,pizza bolis,8 inch sub add salt and pepper,0,g,0,mg,125,g,0,g,0,g,0,g,0,g,0,g,0,g
3,pizza bolis,8 inch sub add shrimp,0,g,75,mg,220,g,0,g,9,g,0,g,0,g,0,g,0,g
4,pizza bolis,8 inch sub add tomato,0,g,0,mg,0,g,2,g,0,g,0,g,0,g,1,g,0,g
5,pizza bolis,add anchovies large pizza,0,g,0,mg,160,g,0,g,1,g,0,g,0,g,0,g,0,g
6,pizza bolis,add anchovies medium pizza,0,g,0,mg,120,g,0,g,1,g,0,g,0,g,0,g,0,g
7,pizza bolis,add anchovies small pizza,0,g,0,mg,80,g,0,g,0,g,0,g,0,g,0,g,0,g
8,pizza bolis,add anchovies x large pizza,0,g,0,mg,190,g,0,g,1,g,0,g,0,g,0,g,0,g
9,pizza bolis,add bacon large pizza,3,g,10,mg,100,g,0,g,2,g,1,g,0,g,0,g,0,g
10,pizza bolis,add bacon medium pizza,2,g,5,mg,70,g,0,g,1,g,1,g,0,g,0,g,0,g
11,pizza bolis,add bacon small pizza,2,g,5,mg,50,g,0,g,1,g,1,g,0,g,0,g,0,g
12,pizza bolis,add bacon x large pizza,4,g,10,mg,120,g,0,g,2,g,2,g,0,g,0,g,0,g
13,pizza bolis,add banana peppers large pizza,0,g,0,mg,270,g,1,g,0,g,0,g,0,g,0,g,0,g
14,pizza bolis,add banana peppers medium pizza,0,g,0,mg,360,g,2,g,0,g,0,g,0,g,0,g,0,g
15,pizza bolis,add banana peppers small pizza,0,g,0,mg,90,g,0,g,0,g,0,g,0,g,0,g,0,g
16,pizza bolis,add banana peppers x large pizza,0,g,0,mg,300,g,1,g,0,g,0,g,0,g,0,g,0,g
17,pizza bolis,add black olives large pizza,4,g,0,mg,230,g,0,g,0,g,0,g,0,g,0,g,0,g
18,pizza bolis,add black olives medium pizza,3,g,0,mg,160,g,0,g,0,g,0,g,0,g,0,g,0,g
19,pizza bolis,add black olives small pizza,2,g,0,mg,100,g,0,g,0,g,0,g,0,g,0,g,0,g
20,pizza bolis,add black olives x large pizza,5,g,0,mg,290,g,0,g,0,g,1,g,0,g,0,g,0,g
21,pizza bolis,add broccoli large pizza,0,g,0,mg,0,g,0,g,0,g,0,g,0,g,0,g,0,g
22,pizza bolis,add broccoli medium pizza,0,g,0,mg,0,g,0,g,0,g,0,g,0,g,0,g,0,g
23,pizza bolis,add broccoli x large pizza,0,g,0,mg,0,g,0,g,0,g,0,g,0,g,0,g,0,g
24,pizza bolis,add cheese extra large pizza,9,g,35,mg,310,g,1,g,11,g,6,g,0,g,0,g,0,g
25,pizza bolis,add cheese extra medium pizza,7,g,25,mg,240,g,1,g,9,g,4,g,0,g,0,g,0,g
26,pizza bolis,add cheese extra small pizza,5,g,15,mg,160,g,1,g,6,g,3,g,0,g,0,g,0,g
27,pizza bolis,add cheese extra x large pizza,11,g,40,mg,370,g,2,g,13,g,7,g,0,g,0,g,0,g
28,pizza bolis,add chicken steak meat large pizza,1,g,15,mg,25,g,1,g,3,g,0,g,0,g,0,g,0,g
29,pizza bolis,add chicken steak meat medium pizza,1,g,10,mg,15,g,0,g,2,g,0,g,0,g,0,g,0,g
30,pizza bolis,add chicken steak meat small pizza,0,g,5,mg,10,g,0,g,1,g,0,g,0,g,0,g,0,g
31,pizza bolis,add chicken steak meat x large pizza,1,g,20,mg,25,g,1,g,3,g,1,g,0,g,0,g,0,g
32,pizza bolis,add crab large pizza,0,g,15,mg,55,g,0,g,3,g,0,g,0,g,0,g,0,g
33,pizza bolis,add crab medium pizza,0,g,10,mg,40,g,0,g,3,g,0,g,0,g,0,g,0,g
34,pizza bolis,add crab small pizza,0,g,5,mg,25,g,0,g,2,g,0,g,0,g,0,g,0,g
35,pizza bolis,add crab x large pizza,0,g,20,mg,65,g,0,g,4,g,0,g,0,g,0,g,0,g
36,pizza bolis,add extra pizza bolis sauce large,0,g,0,mg,55,g,2,g,0,g,0,g,0,g,0,g,1,g
37,pizza bolis,add extra pizza bolis sauce medium,0,g,0,mg,35,g,1,g,0,g,0,g,0,g,0,g,1,g
38,pizza bolis,add extra pizza bolis sauce small,0,g,0,mg,25,g,1,g,0,g,0,g,0,g,0,g,1,g
39,pizza bolis,add extra pizza bolis sauce x large,0,g,0,mg,70,g,2,g,0,g,0,g,0,g,0,g,2,g
40,pizza bolis,add feta cheese large pizza,1,g,5,mg,70,g,0,g,1,g,0,g,0,g,0,g,0,g
41,pizza bolis,add feta cheese medium pizza,1,g,5,mg,45,g,0,g,1,g,0,g,0,g,0,g,0,g
42,pizza bolis,add feta cheese small pizza,0,g,0,mg,25,g,0,g,0,g,0,g,0,g,0,g,0,g
43,pizza bolis,add feta cheese x large pizza,1,g,5,mg,95,g,0,g,1,g,1,g,0,g,0,g,0,g
44,pizza bolis,add green olives large pizza,0,g,0,mg,270,g,0,g,0,g,0,g,0,g,0,g,0,g
45,pizza bolis,add green olives medium pizza,0,g,0,mg,230,g,0,g,0,g,0,g,0,g,0,g,0,g
46,pizza bolis,add green olives small pizza,0,g,0,mg,135,g,0,g,0,g,0,g,0,g,0,g,0,g
47,pizza bolis,add green olives x large pizza,0,g,0,mg,360,g,0,g,0,g,0,g,0,g,0,g,0,g
48,pizza bolis,add green peppers large pizza,0,g,0,mg,0,g,0,g,0,g,0,g,0,g,0,g,0,g
49,pizza bolis,add green peppers medium pizza,0,g,0,mg,0,g,0,g,0,g,0,g,0,g,0,g,0,g
50,pizza bolis,add green peppers small pizza,0,g,0,mg,0,g,0,g,0,g,0,g,0,g,0,g,0,g
51,pizza bolis,add green peppers x large pizza,0,g,0,mg,0,g,1,g,0,g,0,g,0,g,0,g,0,g
52,pizza bolis,add grilled marinated chicken large pizza,0,g,10,mg,35,g,0,g,5,g,0,g,0,g,0,g,0,g
53,pizza bolis,add grilled marinated chicken medium pizza,0,g,10,mg,25,g,0,g,3,g,0,g,0,g,0,g,0,g
54,pizza bolis,add grilled marinated chicken small pizza,0,g,5,mg,10,g,0,g,2,g,0,g,0,g,0,g,0,g
55,pizza bolis,add grilled marinated chicken x large pizza,0,g,15,mg,40,g,0,g,6,g,0,g,0,g,0,g,0,g
56,pizza bolis,add ground beef large pizza,2,g,5,mg,115,g,1,g,3,g,1,g,0,g,1,g,0,g
57,pizza bolis,add ground beef medium pizza,2,g,5,mg,90,g,0,g,2,g,1,g,0,g,0,g,0,g
58,pizza bolis,add ground beef small pizza,1,g,5,mg,65,g,0,g,1,g,0,g,0,g,0,g,0,g
59,pizza bolis,add ground beef x large pizza,3,g,10,mg,150,g,1,g,3,g,1,g,0,g,1,g,0,g
60,pizza bolis,add gyro meat large pizza,4,g,15,mg,135,g,1,g,3,g,2,g,0,g,0,g,0,g
61,pizza bolis,add gyro meat medium pizza,3,g,10,mg,90,g,1,g,2,g,1,g,0,g,0,g,0,g
62,pizza bolis,add gyro meat small pizza,2,g,5,mg,60,g,1,g,1,g,1,g,0,g,0,g,0,g
63,pizza bolis,add gyro meat x large pizza,5,g,15,mg,180,g,1,g,4,g,2,g,0,g,0,g,0,g
64,pizza bolis,add ham large pizza,0,g,5,mg,65,g,0,g,1,g,0,g,0,g,0,g,0,g
65,pizza bolis,add ham medium pizza,0,g,5,mg,50,g,0,g,1,g,0,g,0,g,0,g,0,g
66,pizza bolis,add ham small pizza,0,g,5,mg,30,g,0,g,1,g,0,g,0,g,0,g,0,g
67,pizza bolis,add ham x large pizza,1,g,5,mg,80,g,0,g,2,g,0,g,0,g,0,g,0,g
68,pizza bolis,add italian salami large pizza,1,g,5,mg,80,g,0,g,1,g,0,g,0,g,0,g,0,g
69,pizza bolis,add italian salami medium pizza,1,g,5,mg,60,g,0,g,1,g,0,g,0,g,0,g,0,g
70,pizza bolis,add italian salami small pizza,0,g,5,mg,40,g,0,g,1,g,0,g,0,g,0,g,0,g
71,pizza bolis,add italian salami x large pizza,1,g,5,mg,100,g,0,g,1,g,0,g,0,g,0,g,0,g
72,pizza bolis,add italian sausage large pizza,6,g,10,mg,150,g,1,g,3,g,2,g,0,g,0,g,0,g
73,pizza bolis,add italian sausage medium pizza,4,g,10,mg,110,g,1,g,2,g,2,g,0,g,0,g,0,g
74,pizza bolis,add italian sausage small pizza,3,g,5,mg,75,g,0,g,1,g,1,g,0,g,0,g,0,g
75,pizza bolis,add italian sausage x large pizza,7,g,15,mg,180,g,1,g,3,g,3,g,0,g,0,g,0,g
76,pizza bolis,add jalapeno peppers large pizza,0,g,0,mg,150,g,1,g,0,g,0,g,0,g,0,g,0,g
77,pizza bolis,add jalapeno peppers medium pizza,0,g,0,mg,120,g,1,g,0,g,0,g,0,g,0,g,0,g
78,pizza bolis,add jalapeno peppers small pizza,0,g,0,mg,60,g,0,g,0,g,0,g,0,g,0,g,0,g
79,pizza bolis,add jalapeno peppers x large pizza,0,g,0,mg,240,g,1,g,0,g,0,g,0,g,0,g,0,g
80,pizza bolis,add meatballs large pizza,3,g,10,mg,105,g,1,g,3,g,1,g,0,g,0,g,0,g
81,pizza bolis,add meatballs medium pizza,2,g,10,mg,65,g,1,g,2,g,1,g,0,g,0,g,0,g
82,pizza bolis,add meatballs small pizza,1,g,5,mg,45,g,0,g,1,g,1,g,0,g,0,g,0,g
83,pizza bolis,add meatballs x large pizza,5,g,15,mg,150,g,1,g,4,g,2,g,0,g,0,g,0,g
84,pizza bolis,add mushrooms large pizza,0,g,0,mg,0,g,0,g,0,g,0,g,0,g,0,g,0,g
85,pizza bolis,add mushrooms medium pizza,0,g,0,mg,0,g,0,g,0,g,0,g,0,g,0,g,0,g
86,pizza bolis,add mushrooms small pizza,0,g,0,mg,0,g,0,g,0,g,0,g,0,g,0,g,0,g
87,pizza bolis,add mushrooms x large pizza,0,g,0,mg,0,g,1,g,1,g,0,g,0,g,0,g,0,g
88,pizza bolis,add onions large pizza,0,g,0,mg,0,g,1,g,0,g,0,g,0,g,0,g,1,g
89,pizza bolis,add onions medium pizza,0,g,0,mg,0,g,1,g,0,g,0,g,0,g,0,g,1,g
90,pizza bolis,add onions small pizza,0,g,0,mg,0,g,0,g,0,g,0,g,0,g,0,g,0,g
91,pizza bolis,add onions x large pizza,0,g,0,mg,0,g,1,g,0,g,0,g,0,g,0,g,1,g
92,pizza bolis,add pepperoni large pizza,3,g,10,mg,140,g,0,g,2,g,1,g,0,g,0,g,0,g
93,pizza bolis,add pepperoni medium pizza,2,g,5,mg,110,g,0,g,1,g,1,g,0,g,0,g,0,g
94,pizza bolis,add pepperoni small pizza,1,g,5,mg,60,g,0,g,1,g,0,g,0,g,0,g,0,g
95,pizza bolis,add pepperoni x large pizza,4,g,10,mg,180,g,0,g,2,g,1,g,0,g,0,g,0,g
96,pizza bolis,add pineapple large pizza,0,g,0,mg,0,g,3,g,0,g,0,g,0,g,0,g,3,g
97,pizza bolis,add pineapple medium pizza,0,g,0,mg,0,g,2,g,0,g,0,g,0,g,0,g,2,g
98,pizza bolis,add pineapple small pizza,0,g,0,mg,0,g,1,g,0,g,0,g,0,g,0,g,1,g
99,pizza bolis,add pineapple x large pizza,0,g,0,mg,0,g,4,g,0,g,0,g,0,g,0,g,4,g
100,pizza bolis,add pizza bolis cheese large pizza,6,g,25,mg,210,g,1,g,8,g,4,g,0,g,0,g,0,g
101,pizza bolis,add pizza bolis cheese medium pizza,5,g,15,mg,160,g,1,g,6,g,3,g,0,g,0,g,0,g
102,pizza bolis,add pizza bolis cheese small pizza,3,g,10,mg,105,g,0,g,4,g,2,g,0,g,0,g,0,g
103,pizza bolis,add pizza bolis cheese x large pizza,8,g,30,mg,260,g,1,g,10,g,5,g,0,g,0,g,0,g
104,pizza bolis,add shrimp large pizza,0,g,25,mg,65,g,0,g,3,g,0,g,0,g,0,g,0,g
105,pizza bolis,add shrimp medium pizza,0,g,15,mg,45,g,0,g,2,g,0,g,0,g,0,g,0,g
106,pizza bolis,add shrimp small pizza,0,g,10,mg,20,g,0,g,1,g,0,g,0,g,0,g,0,g
107,pizza bolis,add shrimp x large pizza,0,g,30,mg,90,g,0,g,4,g,0,g,0,g,0,g,0,g
108,pizza bolis,add sirloin steak meat large pizza,1,g,5,mg,60,g,0,g,3,g,1,g,0,g,0,g,0,g
109,pizza bolis,add sirloin steak meat medium pizza,1,g,5,mg,40,g,0,g,2,g,0,g,0,g,0,g,0,g
110,pizza bolis,add sirloin steak meat small pizza,0,g,5,mg,20,g,0,g,1,g,0,g,0,g,0,g,0,g
111,pizza bolis,add sirloin steak meat x large pizza,1,g,10,mg,70,g,0,g,3,g,1,g,0,g,0,g,0,g
112,pizza bolis,add spinach large pizza,0,g,0,mg,5,g,0,g,0,g,0,g,0,g,0,g,0,g
113,pizza bolis,add spinach medium pizza,0,g,0,mg,0,g,0,g,0,g,0,g,0,g,0,g,0,g
114,pizza bolis,add spinach small pizza,0,g,0,mg,0,g,0,g,0,g,0,g,0,g,0,g,0,g
115,pizza bolis,add spinach x large pizza,0,g,0,mg,10,g,0,g,0,g,0,g,0,g,0,g,0,g
116,pizza bolis,add tomato large pizza,0,g,0,mg,0,g,1,g,0,g,0,g,0,g,0,g,0,g
117,pizza bolis,add tomato medium pizza,0,g,0,mg,0,g,1,g,0,g,0,g,0,g,0,g,0,g
118,pizza bolis,add tomato small pizza,0,g,0,mg,0,g,0,g,0,g,0,g,0,g,0,g,0,g
119,pizza bolis,add tomato x large pizza,0,g,0,mg,0,g,1,g,0,g,0,g,0,g,0,g,0,g
120,pizza bolis,alfredo pizza sauce large,1,g,5,mg,60,g,1,g,1,g,1,g,0,g,0,g,0,g
121,pizza bolis,alfredo pizza sauce medium,0,g,5,mg,40,g,0,g,0,g,0,g,0,g,0,g,0,g
122,pizza bolis,alfredo pizza sauce small,0,g,0,mg,20,g,0,g,0,g,0,g,0,g,0,g,0,g
123,pizza bolis,alfredo pizza sauce x large,1,g,5,mg,75,g,1,g,1,g,1,g,0,g,0,g,0,g
124,pizza bolis,asian zing wing sauce,0,g,0,mg,135,g,8,g,0,g,0,g,0,g,0,g,7,g
125,pizza bolis,b b q chicken pizza large,11,g,50,mg,830,g,43,g,23,g,6,g,0,g,2,g,10,g
126,pizza bolis,b b q chicken pizza medium,8,g,40,mg,570,g,27,g,17,g,5,g,0,g,1,g,7,g
127,pizza bolis,b b q chicken pizza small,6,g,25,mg,410,g,21,g,12,g,3,g,0,g,1,g,4,g
128,pizza bolis,b b q chicken pizza x large,13,g,60,mg,1010,g,53,g,28,g,7,g,0,g,2,g,14,g
129,pizza bolis,bacon cheese fantastic fries,26,g,120,mg,2030,g,71,g,39,g,25,g,1,g,4,g,3,g
130,pizza bolis,bbq chips,9,g,0,mg,290,g,15,g,2,g,3,g,0,g,1,g,2,g
131,pizza bolis,bbq pizza sauce large,0,g,0,mg,150,g,9,g,0,g,0,g,0,g,8,g,8,g
132,pizza bolis,bbq pizza sauce medium,0,g,0,mg,90,g,6,g,0,g,0,g,0,g,5,g,5,g
133,pizza bolis,bbq pizza sauce small,0,g,0,mg,55,g,3,g,0,g,0,g,0,g,3,g,3,g
134,pizza bolis,bbq pizza sauce x large,0,g,0,mg,200,g,12,g,0,g,0,g,0,g,11,g,11,g
135,pizza bolis,bbq wing sauce,0,g,0,mg,190,g,12,g,0,g,0,g,0,g,0,g,0,g
136,pizza bolis,ben and jerrys cherry garcia,12,g,0,mg,20,g,32,g,2,g,8,g,0,g,1,g,25,g
137,pizza bolis,ben and jerrys choco chip cookie dough,15,g,75,mg,50,g,32,g,4,g,9,g,0.5,g,0,g,25,g
138,pizza bolis,ben and jerrys choco fudge brownie,11,g,0,mg,45,g,23,g,3,g,6,g,0,g,2,g,16,g
139,pizza bolis,ben and jerrys vanilla,16,g,90,mg,50,g,21,g,4,g,10,g,0.5,g,0,g,20,g
140,pizza bolis,blue cheese dipping cup,5,g,25,mg,300,g,2,g,1,g,5,g,0,g,2,g,2,g
141,pizza bolis,blue cheese dressing,24,g,20,mg,310,g,2,g,1,g,5,g,0,g,0,g,2,g
142,pizza bolis,breaded chicken pasta topping,14,g,50,mg,670,g,17,g,21,g,3,g,0,g,0,g,0,g
143,pizza bolis,breadsticks,75,g,0,mg,3600,g,247,g,43,g,20,g,0,g,8,g,12,g
144,pizza bolis,breadsticks with cheese,112,g,135,mg,4850,g,253,g,89,g,43,g,1,g,10,g,13,g
145,pizza bolis,brisk iced tea 2 liter,0,g,0,mg,105,g,17,g,0,g,0,g,0,g,0,g,17,g
146,pizza bolis,brisk iced tea bottle,0,g,0,mg,170,g,29,g,0,g,0,g,0,g,0,g,29,g
147,pizza bolis,brisk iced tea can,0,g,0,mg,105,g,17,g,0,g,0,g,0,g,0,g,17,g
148,pizza bolis,buffalo chicken pizza large,12,g,50,mg,750,g,33,g,23,g,7,g,0,g,1,g,2,g
149,pizza bolis,buffalo chicken pizza medium,9,g,40,mg,510,g,21,g,17,g,5,g,0,g,1,g,1,g
150,pizza bolis,buffalo chicken pizza small,6,g,25,mg,380,g,17,g,12,g,3,g,0,g,1,g,1,g
151,pizza bolis,buffalo chicken pizza x large,15,g,60,mg,910,g,39,g,28,g,8,g,0,g,2,g,2,g
152,pizza bolis,buffalo crispy chicken wrap on flour tortilla,28,g,40,mg,1870,g,85,g,28,g,6,g,0,g,7,g,4,g
153,pizza bolis,buffalo crispy chicken wrap on whole wheat tortilla,28,g,40,mg,1870,g,85,g,28,g,6,g,0,g,10,g,4,g
154,pizza bolis,build your own stromboli add toppings,30,g,70,mg,1600,g,84,g,37,g,13,g,1,g,4,g,7,g
155,pizza bolis,build your own stromboli add anchovies,0,g,0,mg,60,g,0,g,0,g,0,g,0,g,0,g,0,g
156,pizza bolis,build your own stromboli add bacon,1,g,5,mg,35,g,0,g,1,g,0,g,0,g,0,g,0,g
157,pizza bolis,build your own stromboli add banana peppers,0,g,0,mg,360,g,2,g,0,g,0,g,0,g,0,g,0,g
158,pizza bolis,build your own stromboli add black olives,1,g,0,mg,80,g,0,g,0,g,0,g,0,g,0,g,0,g
159,pizza bolis,build your own stromboli add chicken steak meat,0,g,5,mg,10,g,0,g,1,g,0,g,0,g,0,g,0,g
160,pizza bolis,build your own stromboli add crab,0,g,5,mg,20,g,0,g,1,g,0,g,0,g,0,g,0,g
161,pizza bolis,build your own stromboli add extra pizza bolis secret recipe sauce,0,g,0,mg,10,g,0,g,0,g,0,g,0,g,0,g,0,g
162,pizza bolis,build your own stromboli add feta cheese,0,g,0,mg,25,g,0,g,0,g,0,g,0,g,0,g,0,g
163,pizza bolis,build your own stromboli add green olives,0,g,0,mg,115,g,0,g,0,g,0,g,0,g,0,g,0,g
164,pizza bolis,build your own stromboli add green peppers,0,g,0,mg,0,g,0,g,0,g,0,g,0,g,0,g,0,g
165,pizza bolis,build your own stromboli add grilled chicken breast,0,g,5,mg,10,g,0,g,2,g,0,g,0,g,0,g,0,g
166,pizza bolis,build your own stromboli add ground beef,7,g,20,mg,360,g,2,g,8,g,3,g,0,g,2,g,0,g
167,pizza bolis,build your own stromboli add gyro meat,1,g,5,mg,45,g,0,g,1,g,1,g,0,g,0,g,0,g
168,pizza bolis,build your own stromboli add ham,0,g,5,mg,40,g,0,g,1,g,0,g,0,g,0,g,0,g
169,pizza bolis,build your own stromboli add italian salami,0,g,5,mg,30,g,0,g,0,g,0,g,0,g,0,g,0,g
170,pizza bolis,build your own stromboli add italian sausage,17,g,30,mg,440,g,2,g,8,g,7,g,0,g,1,g,1,g
171,pizza bolis,build your own stromboli add jalapeno peppers,0,g,0,mg,60,g,0,g,0,g,0,g,0,g,0,g,0,g
172,pizza bolis,build your own stromboli add meatballs,1,g,5,mg,30,g,0,g,1,g,0,g,0,g,0,g,0,g
173,pizza bolis,build your own stromboli add mushrooms,0,g,0,mg,0,g,0,g,0,g,0,g,0,g,0,g,0,g
174,pizza bolis,build your own stromboli add onions,0,g,0,mg,0,g,0,g,0,g,0,g,0,g,0,g,0,g
175,pizza bolis,build your own stromboli add pepperoni,1,g,5,mg,55,g,0,g,1,g,0,g,0,g,0,g,0,g
176,pizza bolis,build your own stromboli add pizza bolis cheese,2,g,10,mg,80,g,0,g,3,g,1,g,0,g,0,g,0,g
177,pizza bolis,build your own stromboli add shrimp,0,g,10,mg,20,g,0,g,1,g,0,g,0,g,0,g,0,g
178,pizza bolis,build your own stromboli add sirloin steak meat,0,g,5,mg,20,g,0,g,1,g,0,g,0,g,0,g,0,g
179,pizza bolis,build your own stromboli add spinach,0,g,0,mg,0,g,0,g,0,g,0,g,0,g,0,g,0,g
180,pizza bolis,build your own stromboli add tomato,0,g,0,mg,0,g,0,g,0,g,0,g,0,g,0,g,0,g
181,pizza bolis,burger sub 12 inch,32,g,85,mg,1110,g,52,g,31,g,13,g,2,g,2,g,5,g
182,pizza bolis,burger sub 8 inch,43,g,110,mg,1480,g,68,g,40,g,17,g,2,g,2,g,6,g
183,pizza bolis,caesar dressing,23,g,0,mg,390,g,2,g,1,g,4,g,0,g,0,g,1,g
184,pizza bolis,caesar salad,22,g,40,mg,740,g,42,g,24,g,8,g,0,g,20,g,10,g
185,pizza bolis,cajun wing sauce,2,g,0,mg,180,g,0,g,0,g,0,g,0,g,0,g,0,g
186,pizza bolis,caribbean wing dry rub,0,g,0,mg,75,g,0,g,0,g,0,g,0,g,0,g,0,g
187,pizza bolis,carrot cake,14,g,40,mg,280,g,39,g,3,g,3.5,g,0,g,1,g,26,g
188,pizza bolis,cheese pizza large,4,g,25,mg,580,g,34,g,13,g,4,g,0,g,3,g,3,g
189,pizza bolis,cheese pizza medium,3,g,15,mg,400,g,21,g,9,g,3,g,0,g,2,g,2,g
190,pizza bolis,cheese pizza small,2,g,10,mg,300,g,18,g,7,g,2,g,0,g,2,g,2,g
191,pizza bolis,cheese pizza x large,7,g,40,mg,830,g,41,g,20,g,7,g,0,g,4,g,4,g
192,pizza bolis,cheeseburger sub 12 inch,37,g,100,mg,1470,g,54,g,34,g,16,g,2,g,2,g,6,g
193,pizza bolis,cheeseburger sub 8 inch,50,g,135,mg,1960,g,71,g,45,g,22,g,2,g,2,g,7,g
194,pizza bolis,cheesecake,22,g,70,mg,300,g,33,g,6,g,14,g,0.5,g,1,g,25,g
195,pizza bolis,cheesesteak fantastic fries,15,g,75,mg,1270,g,73,g,31,g,14,g,0,g,6,g,5,g
196,pizza bolis,cheesesteak sub 12 inch,20,g,65,mg,1100,g,48,g,34,g,9,g,0,g,3,g,4,g
197,pizza bolis,cheesesteak sub 8 inch,27,g,85,mg,1470,g,63,g,44,g,11,g,0,g,3,g,5,g
198,pizza bolis,chef salad,34,g,120,mg,3090,g,45,g,40,g,14,g,0,g,17,g,14,g
199,pizza bolis,chicken alfredo pizza large,6,g,20,mg,460,g,32,g,13,g,2,g,0,g,1,g,2,g
200,pizza bolis,chicken alfredo pizza medium,4,g,15,mg,300,g,20,g,8,g,1,g,0,g,1,g,1,g
201,pizza bolis,chicken alfredo pizza small,4,g,15,mg,280,g,17,g,8,g,2,g,0,g,1,g,1,g
202,pizza bolis,chicken alfredo pizza x large,13,g,45,mg,770,g,40,g,23,g,6,g,0,g,2,g,3,g
203,pizza bolis,chicken caesar wrap on flour tortilla,52,g,105,mg,1580,g,57,g,52,g,13,g,0,g,5,g,5,g
204,pizza bolis,chicken caesar wrap on whole wheat tortilla,52,g,105,mg,1580,g,57,g,52,g,13,g,0,g,8,g,5,g
205,pizza bolis,chicken cheeseseak sub 12 inch,18,g,120,mg,890,g,49,g,33,g,8,g,0,g,2,g,5,g
206,pizza bolis,chicken cheeseseak sub 8 inch,24,g,155,mg,1190,g,65,g,43,g,11,g,0,g,2,g,6,g
207,pizza bolis,chicken fajita pizza large,8,g,35,mg,770,g,36,g,18,g,4,g,0,g,2,g,4,g
208,pizza bolis,chicken fajita pizza medium,6,g,25,mg,510,g,23,g,13,g,3,g,0,g,1,g,3,g
209,pizza bolis,chicken fajita pizza small,4,g,15,mg,380,g,20,g,9,g,2,g,0,g,1,g,2,g
210,pizza bolis,chicken fajita pizza x large,13,g,55,mg,1080,g,45,g,26,g,7,g,0,g,3,g,5,g
211,pizza bolis,chicken fettuccini alfredo pasta,55,g,155,mg,1650,g,83,g,61,g,20,g,1,g,4,g,12,g
212,pizza bolis,chicken filet sub 12 inch,25,g,75,mg,1490,g,71,g,41,g,5,g,0,g,2,g,4,g
213,pizza bolis,chicken filet sub 8 inch,33,g,100,mg,1980,g,94,g,54,g,6,g,0,g,2,g,4,g
214,pizza bolis,chicken gyro 12 inch,33,g,150,mg,1570,g,26,g,44,g,13,g,0,g,11,g,13,g
215,pizza bolis,chicken parmesan,49,g,145,mg,2470,g,110,g,67,g,19,g,1,g,7,g,23,g
216,pizza bolis,chicken parmesan sub 12 inch,35,g,100,mg,1970,g,76,g,49,g,9,g,0,g,3,g,8,g
217,pizza bolis,chicken parmesan sub 8 inch,47,g,130,mg,2670,g,102,g,65,g,12,g,0,g,3,g,11,g
218,pizza bolis,chicken steak sub 12 inch,4,g,95,mg,620,g,49,g,25,g,4,g,0,g,5,g,5,g
219,pizza bolis,chicken steak sub 8 inch,5,g,125,mg,830,g,65,g,33,g,5,g,0,g,6,g,6,g
220,pizza bolis,chicken tenders platter 3 pieces with crispy fries,6,g,60,mg,2270,g,91,g,30,g,6,g,0,g,3,g,3,g
221,pizza bolis,chicken tenders platter 5 pieces with crispy fries,10,g,100,mg,3720,g,144,g,50,g,9,g,0,g,5,g,5,g
222,pizza bolis,chocolate cake,12,g,30,mg,290,g,42,g,3,g,4,g,0,g,2,g,27,g
223,pizza bolis,cinnaboli sticks,122,g,0,mg,2510,g,174,g,27,g,22,g,0,g,5,g,8,g
224,pizza bolis,cocktail sauce cup,0,g,0,mg,530,g,7,g,1,g,0,g,0,g,0,g,6,g
225,pizza bolis,creamy alfredo pasta sauce,34,g,50,mg,930,g,10,g,8,g,11,g,1,g,0,g,5,g
226,pizza bolis,crispy french fries with cheddar cheese sauce,9,g,20,mg,2460,g,90,g,9,g,8,g,0,g,11,g,10,g
227,pizza bolis,crispy french fries large,21,g,0,mg,620,g,66,g,5,g,4,g,0,g,3,g,2,g
228,pizza bolis,crispy french fries small,15,g,0,mg,470,g,50,g,4,g,3,g,0,g,2,g,2,g
229,pizza bolis,crispy thin crust large,1,g,0,mg,40,g,17,g,3,g,1,g,0,g,0,g,0,g
230,pizza bolis,crush orange soda 2 liter,0,g,0,mg,70,g,43,g,0,g,0,g,0,g,0,g,43,g
231,pizza bolis,crush orange soda bottle,0,g,0,mg,120,g,72,g,0,g,0,g,0,g,0,g,71,g
232,pizza bolis,crush orange soda can,0,g,0,mg,70,g,43,g,0,g,0,g,0,g,0,g,43,g
233,pizza bolis,diet pepsi 2 liter,0,g,0,mg,35,g,0,g,0,g,0,g,0,g,0,g,0,g
234,pizza bolis,diet pepsi bottle,0,g,0,mg,60,g,0,g,0,g,0,g,0,g,0,g,0,g
235,pizza bolis,diet pepsi can,0,g,0,mg,35,g,0,g,0,g,0,g,0,g,0,g,0,g
236,pizza bolis,extra hot buffalo wing sauce,2,g,0,mg,170,g,0,g,0,g,0,g,0,g,0,g,0,g
237,pizza bolis,fat free italian dressing,0,g,0,mg,680,g,5,g,0,g,0,g,0,g,1,g,2,g
238,pizza bolis,fettuccini pasta,2,g,0,mg,25,g,68,g,11,g,0,g,0,g,3,g,5,g
239,pizza bolis,fish filet sub 12 inch,16,g,75,mg,930,g,79,g,31,g,3,g,0,g,4,g,5,g
240,pizza bolis,fish filet sub 8 inch,21,g,100,mg,1240,g,104,g,40,g,3,g,0,g,4,g,6,g
241,pizza bolis,flour tortilla,8,g,0,mg,460,g,46,g,8,g,3,g,0,g,1,g,1,g
242,pizza bolis,fried mushrooms,2,g,0,mg,840,g,32,g,7,g,2,g,0,g,8,g,8,g
243,pizza bolis,garden salad large,4,g,0,mg,1090,g,37,g,6,g,0,g,0,g,17,g,13,g
244,pizza bolis,garden salad small,2,g,0,mg,540,g,19,g,3,g,0,g,0,g,8,g,7,g
245,pizza bolis,garlic bread side for pasta,40,g,0,mg,810,g,12,g,0,g,12,g,0,g,0,g,0,g
246,pizza bolis,garlic bread side order,60,g,0,mg,1280,g,24,g,0,g,18,g,0,g,0,g,0,g
247,pizza bolis,garlic bread with cheese,79,g,70,mg,1920,g,27,g,23,g,30,g,1,g,1,g,0,g
248,pizza bolis,garlic butter sauce side,26,g,0,mg,370,g,0,g,0,g,5,g,0,g,0,g,0,g
249,pizza bolis,garlic herb pizza sauce large,3,g,0,mg,170,g,0,g,0,g,3,g,0,g,0,g,0,g
250,pizza bolis,garlic herb pizza sauce medium,2,g,0,mg,130,g,0,g,0,g,2,g,0,g,0,g,0,g
251,pizza bolis,garlic herb pizza sauce small,2,g,0,mg,85,g,0,g,0,g,2,g,0,g,0,g,0,g
252,pizza bolis,garlic herb pizza sauce x large,4,g,0,mg,210,g,0,g,0,g,4,g,0,g,0,g,0,g
253,pizza bolis,gluten free crust medium,0,g,0,mg,180,g,17,g,1,g,0,g,0,g,1,g,1,g
254,pizza bolis,greek pizza large,34,g,45,mg,950,g,37,g,19,g,17,g,0,g,3,g,3,g
255,pizza bolis,greek pizza medium,24,g,30,mg,650,g,24,g,13,g,12,g,0,g,2,g,2,g
256,pizza bolis,greek pizza small,17,g,20,mg,460,g,19,g,9,g,8,g,0,g,1,g,1,g
257,pizza bolis,greek pizza x large,46,g,60,mg,1230,g,45,g,23,g,22,g,0,g,3,g,4,g
258,pizza bolis,greek salad,20,g,60,mg,2570,g,42,g,26,g,10,g,0,g,17,g,13,g
259,pizza bolis,grilled chicken sub 12 inch,5,g,65,mg,670,g,46,g,36,g,2,g,0,g,2,g,4,g
260,pizza bolis,grilled chicken sub 8 inch,6,g,80,mg,880,g,61,g,45,g,2,g,0,g,2,g,4,g
261,pizza bolis,grilled marinated chicken breast pasta topping,2,g,80,mg,240,g,1,g,33,g,1,g,0,g,0,g,0,g
262,pizza bolis,ground beef pasta topping,16,g,40,mg,820,g,4,g,18,g,6,g,0,g,4,g,0,g
263,pizza bolis,gyro 12 inch,50,g,140,mg,1980,g,33,g,44,g,22,g,0,g,11,g,13,g
264,pizza bolis,ham and cheese sub 12 inch,18,g,95,mg,2120,g,53,g,38,g,7,g,0,g,2,g,4,g
265,pizza bolis,ham and cheese sub 8 inch,22,g,115,mg,2650,g,69,g,47,g,9,g,0,g,2,g,5,g
266,pizza bolis,hand tossed crust large,2,g,0,mg,320,g,31,g,5,g,0,g,0,g,1,g,2,g
267,pizza bolis,hand tossed crust medium,1,g,0,mg,200,g,20,g,3,g,0,g,0,g,1,g,1,g
268,pizza bolis,hand tossed crust small,1,g,0,mg,170,g,16,g,3,g,0,g,0,g,1,g,1,g
269,pizza bolis,hand tossed crust x large,2,g,0,mg,390,g,37,g,7,g,0,g,0,g,1,g,2,g
270,pizza bolis,hawaiian pizza large,12,g,40,mg,820,g,39,g,20,g,6,g,0,g,2,g,7,g
271,pizza bolis,hawaiian pizza medium,9,g,30,mg,570,g,25,g,14,g,5,g,0,g,1,g,5,g
272,pizza bolis,hawaiian pizza small,6,g,20,mg,420,g,20,g,10,g,3,g,0,g,1,g,3,g
273,pizza bolis,hawaiian pizza x large,14,g,50,mg,990,g,47,g,24,g,7,g,0,g,3,g,9,g
274,pizza bolis,healthy whole wheat crust large,0,g,0,mg,35,g,3,g,1,g,0,g,0,g,0,g,0,g
275,pizza bolis,honey bbq wing sauce,0,g,0,mg,75,g,3,g,0,g,0,g,0,g,0,g,3,g
276,pizza bolis,honey mustard sauce cup,13,g,10,mg,350,g,12,g,0,g,2,g,0,g,0,g,11,g
277,pizza bolis,honey mustard wing sauce,2,g,5,mg,55,g,1,g,0,g,0,g,0,g,0,g,10,g
278,pizza bolis,hot buffalo wing sauce,2,g,0,mg,170,g,0,g,0,g,2,g,0,g,0,g,0,g
279,pizza bolis,house dressing,18,g,0,mg,350,g,0,g,0,g,2,g,0,g,0,g,0,g
280,pizza bolis,icing cup,1,g,0,mg,55,g,31,g,0,g,1,g,0,g,0,g,26,g
281,pizza bolis,italian cheesesteak pizza large,10,g,30,mg,670,g,35,g,16,g,5,g,0,g,2,g,4,g
282,pizza bolis,italian cheesesteak pizza medium,7,g,20,mg,460,g,23,g,11,g,3,g,0,g,1,g,3,g
283,pizza bolis,italian cheesesteak pizza small,5,g,15,mg,340,g,18,g,8,g,2,g,0,g,1,g,2,g
284,pizza bolis,italian cheesesteak pizza x large,12,g,35,mg,830,g,43,g,20,g,6,g,0,g,3,g,5,g
285,pizza bolis,italian cheesesteak sub 12 inch,22,g,65,mg,1320,g,55,g,35,g,9,g,0,g,4,g,10,g
286,pizza bolis,italian cheesesteak sub 8 inch,29,g,85,mg,1800,g,74,g,46,g,11,g,0,g,5,g,14,g
287,pizza bolis,italian cold cut wrap on flour tortilla,38,g,135,mg,4000,g,75,g,50,g,14,g,0,g,9,g,8,g
288,pizza bolis,italian cold cut wrap on whole wheat tortilla,38,g,135,mg,4000,g,75,g,50,g,14,g,0,g,12,g,8,g
289,pizza bolis,italian cold hot cut sub 12 inch,26,g,105,mg,2680,g,56,g,41,g,10,g,0,g,3,g,5,g
290,pizza bolis,italian cold hot cut sub 8 inch,34,g,135,mg,3250,g,72,g,52,g,13,g,0,g,4,g,5,g
291,pizza bolis,italian meatball sub 12 inch,33,g,90,mg,1560,g,57,g,34,g,12,g,1,g,4,g,9,g
292,pizza bolis,italian meatball sub 8 inch,41,g,110,mg,2000,g,75,g,42,g,15,g,1,g,5,g,12,g
293,pizza bolis,jalapeno poppers,13,g,40,mg,1620,g,60,g,10,g,12,g,0,g,3,g,3,g
294,pizza bolis,jumbo shrimp platter,7,g,160,mg,1370,g,84,g,23,g,5,g,0,g,2,g,1,g
295,pizza bolis,lasagna,9,g,30,mg,740,g,50,g,18,g,5,g,0,g,2,g,4,g
296,pizza bolis,lasagna pasta with meat sauce,67,g,190,mg,3610,g,80,g,79,g,33,g,1,g,10,g,22,g
297,pizza bolis,lemon pepper wing dry rub,0,g,0,mg,150,g,0,g,0,g,0,g,0,g,0,g,0,g
298,pizza bolis,liquid garlic sauce cup,26,g,0,mg,370,g,0,g,0,g,5,g,0,g,0,g,0,g
299,pizza bolis,marinara pasta sauce,7,g,0,mg,860,g,22,g,4,g,0,g,0,g,4,g,18,g
300,pizza bolis,maryland style crab pizza large,10,g,40,mg,830,g,33,g,16,g,4,g,0,g,1,g,2,g
301,pizza bolis,maryland style crab pizza medium,6,g,25,mg,490,g,21,g,10,g,3,g,0,g,1,g,1,g
302,pizza bolis,maryland style crab pizza small,4,g,15,mg,350,g,17,g,8,g,2,g,0,g,1,g,1,g
