,Restaurant Name,Food Name,Total Fat Amount,Total Fat Unit,Cholesterol Amount,Cholesterol Unit,Sodium Amount,Sodium Unit,Total Carbohydrate Amount,Total Carbohydrate Unit,Protein Amount,Protein Unit,Saturated Fat Amount,Saturated Fat Unit,Trans Fat Amount,Trans Fat Unit,Dietary Fiber Amount,Dietary Fiber Unit,Sugars Amount,Sugars Unit
0,johnnys pizza house,large fountain unsweetened iced tea 32 fl oz,0,g,0,mg,30,g,3,g,0,g,0,g,0,g,0,g,0,g
1,johnnys pizza house,large hog heaven pizza,145,g,405,mg,8620,g,272,g,185,g,53,g,1,g,12,g,42,g
2,johnnys pizza house,large maui wowie pizza,117,g,385,mg,8440,g,282,g,192,g,44,g,0.5,g,13,g,53,g
3,johnnys pizza house,large mighty meaty pizza,166,g,475,mg,8480,g,269,g,203,g,63,g,2,g,12,g,40,g
4,johnnys pizza house,large peach puddin pizza 1 slice,29,g,0,mg,960,g,96,g,6,g,6,g,3.5,g,2,g,48,g
5,johnnys pizza house,large pepperoni power pizza,190,g,405,mg,7320,g,272,g,177,g,79,g,3,g,12,g,39,g
6,johnnys pizza house,large pizza topping anchovies,7,g,60,mg,2600,g,0,g,20,g,1.5,g,0,g,0,g,0,g
7,johnnys pizza house,large pizza topping andouille sausage,40,g,100,mg,1870,g,5,g,20,g,13,g,0,g,0,g,3,g
8,johnnys pizza house,large pizza topping bacon,47,g,125,mg,2620,g,2,g,42,g,16,g,0,g,0,g,0,g
9,johnnys pizza house,large pizza topping bell pepper,0,g,0,mg,0,g,4,g,1,g,0,g,0,g,2,g,2,g
10,johnnys pizza house,large pizza topping black olives,23,g,0,mg,1560,g,13,g,2,g,3,g,0,g,7,g,0,g
11,johnnys pizza house,large pizza topping cheddar cheese,87,g,260,mg,1680,g,11,g,65,g,50,g,3,g,1,g,0,g
12,johnnys pizza house,large pizza topping chicken,4,g,90,mg,480,g,2,g,34,g,1,g,0,g,0,g,0,g
13,johnnys pizza house,large pizza topping crawfish lto,1.5,g,180,mg,2010,g,0,g,23,g,0,g,0,g,0,g,0,g
14,johnnys pizza house,large pizza topping diced tomatoes,0,g,0,mg,10,g,8,g,2,g,0,g,0,g,3,g,6,g
15,johnnys pizza house,large pizza topping green olives,33,g,0,mg,3310,g,8,g,2,g,4.5,g,0,g,7,g,1,g
16,johnnys pizza house,large pizza topping ham,2.5,g,50,mg,1050,g,1,g,19,g,1,g,0,g,0,g,1,g
17,johnnys pizza house,large pizza topping hamburger,23,g,110,mg,95,g,0,g,33,g,9,g,1,g,0,g,0,g
18,johnnys pizza house,large pizza topping jalapenos,1,g,0,mg,1890,g,5,g,1,g,0,g,0,g,3,g,2,g
19,johnnys pizza house,large pizza topping mushroom,0.5,g,0,mg,10,g,7,g,7,g,0,g,0,g,2,g,4,g
20,johnnys pizza house,large pizza topping onion,0,g,0,mg,0,g,11,g,1,g,0,g,0,g,2,g,5,g
21,johnnys pizza house,large pizza topping pepperoni,47,g,105,mg,1680,g,1,g,21,g,18,g,1.5,g,0,g,0,g
22,johnnys pizza house,large pizza topping pineapple,0,g,0,mg,0,g,17,g,1,g,0,g,0,g,1,g,16,g
23,johnnys pizza house,large pizza topping sausage,37,g,85,mg,750,g,1,g,19,g,13,g,0,g,0,g,0,g
24,johnnys pizza house,large pizza topping shrimp lto,0,g,145,mg,2440,g,2,g,22,g,0,g,0,g,0,g,1,g
25,johnnys pizza house,large pizza topping taste of crab lto,0.5,g,25,mg,3020,g,21,g,10,g,0,g,0,g,1,g,9,g
26,johnnys pizza house,large pizza extra sauce,2,g,0,mg,2080,g,33,g,7,g,0,g,0,g,10,g,18,g
27,johnnys pizza house,large pizza lite sauce,1,g,0,mg,960,g,15,g,3,g,0,g,0,g,5,g,8,g
28,johnnys pizza house,large pizza thick crust,36,g,0,mg,390,g,348,g,45,g,2.5,g,1,g,8,g,37,g
29,johnnys pizza house,large pizza thin crust,15,g,0,mg,160,g,145,g,19,g,1,g,0,g,3,g,15,g
30,johnnys pizza house,large sweep the kitchen pizza,152,g,355,mg,7520,g,284,g,165,g,56,g,2,g,18,g,45,g
31,johnnys pizza house,large sweep the swamp pizza lto,101,g,335,mg,7730,g,285,g,138,g,38,g,0.5,g,14,g,47,g
32,johnnys pizza house,large veg out pizza,90,g,145,mg,4540,g,283,g,110,g,33,g,0.5,g,18,g,44,g
33,johnnys pizza house,medium bacon cheeseburger pizza,114,g,305,mg,3890,g,203,g,124,g,47,g,2.5,g,10,g,30,g
34,johnnys pizza house,medium bacon chicken ranchero pizza,148,g,295,mg,3980,g,194,g,117,g,48,g,1.5,g,6,g,22,g
35,johnnys pizza house,medium bbq chicken pizza,95,g,275,mg,4800,g,257,g,119,g,39,g,1.5,g,8,g,80,g
36,johnnys pizza house,medium buffalo chicken pizza,97,g,275,mg,8070,g,194,g,118,g,40,g,2,g,6,g,23,g
37,johnnys pizza house,medium cheese pizza deep pan crust regular sauce,101,g,115,mg,4390,g,291,g,98,g,28,g,1.5,g,14,g,20,g
38,johnnys pizza house,medium cheese pizza original crust regular sauce,61,g,115,mg,2540,g,197,g,81,g,25,g,0,g,8,g,28,g
39,johnnys pizza house,medium fountain coke 16 fl oz,0,g,0,mg,60,g,52,g,0,g,0,g,0,g,0,g,52,g
40,johnnys pizza house,medium fountain coke zero 16 fl oz,0,g,0,mg,55,g,0,g,0,g,0,g,0,g,0,g,0,g
41,johnnys pizza house,medium fountain diet coke 16 fl oz,0,g,0,mg,55,g,0,g,0,g,0,g,0,g,0,g,0,g
42,johnnys pizza house,medium fountain diet dr pepper 16 fl oz,0,g,0,mg,70,g,0,g,0,g,0,g,0,g,0,g,0,g
43,johnnys pizza house,medium fountain dr pepper 16 fl oz,0,g,0,mg,70,g,54,g,0,g,0,g,0,g,0,g,54,g
44,johnnys pizza house,medium fountain orange fanta 16 fl oz,0,g,0,mg,80,g,60,g,0,g,0,g,0,g,0,g,59,g
45,johnnys pizza house,medium fountain pink lemonade 16 fl oz,0,g,0,mg,140,g,57,g,0,g,0,g,0,g,0,g,55,g
46,johnnys pizza house,medium fountain powderade mountain berry blast 16 fl oz,0,g,0,mg,200,g,28,g,0,g,0,g,0,g,0,g,28,g
47,johnnys pizza house,medium fountain root beer 16 fl oz,0,g,0,mg,95,g,60,g,0,g,0,g,0,g,0,g,60,g
48,johnnys pizza house,medium fountain sprite 16 fl oz,0,g,0,mg,45,g,52,g,0,g,0,g,0,g,0,g,52,g
49,johnnys pizza house,medium fountain strawberry fanta 16 fl oz,0,g,0,mg,60,g,64,g,0,g,0,g,0,g,0,g,64,g
50,johnnys pizza house,medium fountain sweet tea 16 fl oz,0,g,0,mg,15,g,66,g,0,g,0,g,0,g,0,g,64,g
51,johnnys pizza house,medium fountain unsweetened iced tea 16 fl oz,0,g,0,mg,15,g,1,g,0,g,0,g,0,g,0,g,0,g
52,johnnys pizza house,medium hog heaven pizza,112,g,305,mg,6320,g,202,g,139,g,41,g,0.5,g,9,g,30,g
53,johnnys pizza house,medium maui wowie pizza,91,g,295,mg,6310,g,210,g,147,g,35,g,0.5,g,9,g,38,g
54,johnnys pizza house,medium mighty meaty pizza,124,g,350,mg,6140,g,200,g,152,g,48,g,1.5,g,8,g,29,g
55,johnnys pizza house,medium peach puddin pizza 1 slice,22,g,0,mg,720,g,72,g,4,g,4.5,g,2.5,g,2,g,36,g
56,johnnys pizza house,medium pepperoni power pizza,145,g,310,mg,5450,g,202,g,136,g,61,g,2.5,g,8,g,29,g
57,johnnys pizza house,medium pizza topping anchovies,4,g,35,mg,1560,g,0,g,12,g,1,g,0,g,0,g,0,g
58,johnnys pizza house,medium pizza topping andouille sausage,32,g,80,mg,1500,g,4,g,16,g,10,g,0,g,0,g,2,g
59,johnnys pizza house,medium pizza topping bacon,36,g,95,mg,1960,g,1,g,31,g,12,g,0,g,0,g,0,g
60,johnnys pizza house,medium pizza topping bell pepper,0,g,0,mg,0,g,3,g,0,g,0,g,0,g,1,g,1,g
61,johnnys pizza house,medium pizza topping black olives,17,g,0,mg,1150,g,10,g,1,g,2,g,0,g,5,g,0,g
62,johnnys pizza house,medium pizza topping cheddar cheese,68,g,205,mg,1330,g,8,g,52,g,39,g,2.5,g,1,g,0,g
63,johnnys pizza house,medium pizza topping chicken,3,g,65,mg,350,g,1,g,25,g,1,g,0,g,0,g,0,g
64,johnnys pizza house,medium pizza topping crawfish lto,1.5,g,145,mg,1610,g,0,g,18,g,0,g,0,g,0,g,0,g
65,johnnys pizza house,medium pizza topping diced tomatoes,0,g,0,mg,10,g,6,g,1,g,0,g,0,g,2,g,4,g
66,johnnys pizza house,medium pizza topping green olives,24,g,0,mg,2430,g,6,g,2,g,3,g,0,g,5,g,1,g
67,johnnys pizza house,medium pizza topping ham,2,g,35,mg,770,g,1,g,14,g,0.5,g,0,g,0,g,0,g
68,johnnys pizza house,medium pizza topping hamburger,16,g,80,mg,70,g,0,g,24,g,6,g,0.5,g,0,g,0,g
69,johnnys pizza house,medium pizza topping jalapenos,1,g,0,mg,1420,g,4,g,1,g,0,g,0,g,2,g,2,g
70,johnnys pizza house,medium pizza topping mushroom,0.5,g,0,mg,10,g,5,g,5,g,0,g,0,g,2,g,3,g
71,johnnys pizza house,medium pizza topping onion,0,g,0,mg,0,g,8,g,1,g,0,g,0,g,1,g,4,g
72,johnnys pizza house,medium pizza topping pepperoni,35,g,80,mg,1230,g,1,g,15,g,14,g,1,g,0,g,0,g
73,johnnys pizza house,medium pizza topping pineapple,0,g,0,mg,0,g,12,g,1,g,0,g,0,g,1,g,11,g
74,johnnys pizza house,medium pizza topping sausage,27,g,60,mg,540,g,1,g,13,g,10,g,0,g,0,g,0,g
75,johnnys pizza house,medium pizza topping shrimp lto,0,g,115,mg,1950,g,1,g,17,g,0,g,0,g,0,g,1,g
76,johnnys pizza house,medium pizza topping taste of crab lto,0.5,g,20,mg,2410,g,17,g,8,g,0,g,0,g,1,g,7,g
77,johnnys pizza house,medium pizza extra sauce,1.5,g,0,mg,1440,g,23,g,5,g,0,g,0,g,7,g,12,g
78,johnnys pizza house,medium pizza lite sauce,0.5,g,0,mg,640,g,10,g,2,g,0,g,0,g,3,g,6,g
79,johnnys pizza house,medium pizza thick crust,27,g,0,mg,290,g,261,g,33,g,2,g,0.5,g,6,g,28,g
80,johnnys pizza house,medium pizza thin crust,10,g,0,mg,115,g,101,g,13,g,1,g,0,g,2,g,11,g
81,johnnys pizza house,medium sweep the kitchen pizza,114,g,265,mg,5380,g,211,g,124,g,42,g,1.5,g,13,g,33,g
82,johnnys pizza house,medium sweep the swamp pizza lto,79,g,260,mg,5770,g,212,g,106,g,30,g,0,g,10,g,35,g
83,johnnys pizza house,medium veg out pizza,69,g,115,mg,3300,g,210,g,85,g,26,g,0,g,13,g,32,g
84,johnnys pizza house,mighty meaty flip,30,g,75,mg,1710,g,78,g,37,g,10,g,0,g,2,g,10,g
85,johnnys pizza house,muffuletta half,105,g,100,mg,5040,g,88,g,51,g,22,g,2.5,g,6,g,4,g
86,johnnys pizza house,muffuletta quarter,58,g,50,mg,2600,g,52,g,26,g,12,g,1,g,4,g,3,g
87,johnnys pizza house,muffuletta whole,200,g,205,mg,9920,g,161,g,100,g,42,g,5,g,12,g,8,g
88,johnnys pizza house,muffuletta flip,33,g,75,mg,1930,g,76,g,38,g,9,g,0,g,2,g,9,g
89,johnnys pizza house,mug bud light 10 fl oz,0,g,0,mg,10,g,4,g,1,g,0,g,0,g,0,g,0,g
90,johnnys pizza house,mug budweiser 10 fl oz,0,g,0,mg,10,g,9,g,1,g,0,g,0,g,0,g,0,g
91,johnnys pizza house,mug coors 10 fl oz,0,g,0,mg,10,g,9,g,1,g,0,g,0,g,0,g,9,g
92,johnnys pizza house,mug michelob 10 fl oz,0,g,0,mg,10,g,11,g,1,g,0,g,0,g,0,g,0,g
93,johnnys pizza house,mug michelob ultra 10 fl oz,0,g,0,mg,10,g,2,g,1,g,0,g,0,g,0,g,0,g
94,johnnys pizza house,mug miller 10 fl oz,0,g,0,mg,5,g,11,g,1,g,0,g,0,g,0,g,0,g
95,johnnys pizza house,mug miller light 10 fl oz,0,g,0,mg,0,g,3,g,1,g,0,g,0,g,0,g,0,g
96,johnnys pizza house,nacho cheese 3 fl oz,10,g,5,mg,680,g,9,g,1,g,2,g,3.5,g,0,g,4,g
97,johnnys pizza house,party pleaser topping anchovies,3,g,25,mg,1040,g,0,g,8,g,0.5,g,0,g,0,g,0,g
98,johnnys pizza house,party pleaser topping andouille,32,g,80,mg,1500,g,4,g,16,g,10,g,0,g,0,g,2,g
99,johnnys pizza house,party pleaser topping bacon,30,g,80,mg,1640,g,1,g,26,g,10,g,0,g,0,g,0,g
100,johnnys pizza house,party pleaser topping bell pepper,0,g,0,mg,0,g,3,g,1,g,0,g,0,g,1,g,2,g
101,johnnys pizza house,party pleaser topping black olives,14,g,0,mg,940,g,8,g,1,g,2,g,0,g,4,g,0,g
102,johnnys pizza house,party pleaser topping chicken,3,g,70,mg,370,g,1,g,26,g,1,g,0,g,0,g,0,g
103,johnnys pizza house,party pleaser topping dcd tomatoes,0,g,0,mg,5,g,5,g,1,g,0,g,0,g,2,g,3,g
104,johnnys pizza house,party pleaser topping green olives,20,g,0,mg,1990,g,5,g,1,g,2.5,g,0,g,4,g,1,g
105,johnnys pizza house,party pleaser topping ham,5,g,100,mg,2120,g,2,g,38,g,2,g,0,g,0,g,1,g
106,johnnys pizza house,party pleaser topping hamburger,18,g,85,mg,75,g,0,g,26,g,7,g,1,g,0,g,0,g
107,johnnys pizza house,party pleaser topping jalapenos,0,g,0,mg,710,g,2,g,0,g,0,g,0,g,1,g,1,g
108,johnnys pizza house,party pleaser topping mushroom,0,g,0,mg,5,g,4,g,4,g,0,g,0,g,1,g,3,g
109,johnnys pizza house,party pleaser topping onion,0,g,0,mg,0,g,7,g,1,g,0,g,0,g,1,g,3,g
110,johnnys pizza house,party pleaser topping pepperoni,30,g,65,mg,1050,g,1,g,13,g,12,g,1,g,0,g,0,g
111,johnnys pizza house,party pleaser topping pineapple,0,g,0,mg,0,g,13,g,1,g,0,g,0,g,1,g,12,g
112,johnnys pizza house,party pleaser topping sausage,29,g,65,mg,580,g,1,g,14,g,10,g,0,g,0,g,0,g
113,johnnys pizza house,pepperoni flip,32,g,60,mg,1270,g,77,g,28,g,11,g,0.5,g,2,g,9,g
114,johnnys pizza house,personal peach puddin pizza 1 slice,9,g,0,mg,300,g,30,g,2,g,2,g,1,g,1,g,15,g
115,johnnys pizza house,personal pizza topping anchovies,2,g,20,mg,780,g,0,g,6,g,0,g,0,g,0,g,0,g
116,johnnys pizza house,personal pizza topping andouille sausage,16,g,40,mg,750,g,2,g,8,g,5,g,0,g,0,g,1,g
117,johnnys pizza house,personal pizza topping bacon,15,g,40,mg,820,g,1,g,13,g,5,g,0,g,0,g,0,g
118,johnnys pizza house,personal pizza topping bell pepper,0,g,0,mg,0,g,1,g,0,g,0,g,0,g,0,g,1,g
119,johnnys pizza house,personal pizza topping black olives,8,g,0,mg,520,g,4,g,1,g,1,g,0,g,2,g,0,g
120,johnnys pizza house,personal pizza topping cheddar cheese,27,g,80,mg,530,g,3,g,21,g,16,g,1,g,0,g,0,g
121,johnnys pizza house,personal pizza topping chicken,1.5,g,30,mg,160,g,1,g,11,g,0,g,0,g,0,g,0,g
122,johnnys pizza house,personal pizza topping crawfish lto,0.5,g,70,mg,800,g,0,g,9,g,0,g,0,g,0,g,0,g
123,johnnys pizza house,personal pizza topping diced tomatoes,0,g,0,mg,0,g,3,g,1,g,0,g,0,g,1,g,2,g
124,johnnys pizza house,personal pizza topping green olives,11,g,0,mg,1100,g,3,g,1,g,1.5,g,0,g,2,g,0,g
125,johnnys pizza house,personal pizza topping ham,1,g,15,mg,350,g,0,g,6,g,0,g,0,g,0,g,0,g
126,johnnys pizza house,personal pizza topping hamburger,8,g,35,mg,30,g,0,g,11,g,3,g,0,g,0,g,0,g
127,johnnys pizza house,personal pizza topping jalapenos,0,g,0,mg,590,g,2,g,0,g,0,g,0,g,1,g,1,g
128,johnnys pizza house,personal pizza topping mushroom,0,g,0,mg,0,g,2,g,2,g,0,g,0,g,1,g,1,g
129,johnnys pizza house,personal pizza topping onion,0,g,0,mg,0,g,3,g,0,g,0,g,0,g,1,g,2,g
130,johnnys pizza house,personal pizza topping pepperoni,16,g,35,mg,560,g,0,g,7,g,6,g,0,g,0,g,0,g
131,johnnys pizza house,personal pizza topping pineapple,0,g,0,mg,0,g,6,g,0,g,0,g,0,g,0,g,5,g
132,johnnys pizza house,personal pizza topping sausage,12,g,30,mg,250,g,0,g,6,g,4.5,g,0,g,0,g,0,g
133,johnnys pizza house,personal pizza topping shrimp lto,0,g,55,mg,980,g,1,g,9,g,0,g,0,g,0,g,1,g
134,johnnys pizza house,personal pizza topping taste of crab lto,0,g,10,mg,1210,g,8,g,4,g,0,g,0,g,0,g,3,g
135,johnnys pizza house,personal pizza extra sauce,0.5,g,0,mg,640,g,10,g,2,g,0,g,0,g,3,g,6,g
136,johnnys pizza house,personal pizza lite sauce,0,g,0,mg,160,g,3,g,1,g,0,g,0,g,1,g,1,g
137,johnnys pizza house,personal pizza thick crust,11,g,0,mg,120,g,109,g,14,g,1,g,0,g,2,g,12,g
138,johnnys pizza house,personal pizza thin crust,5,g,0,mg,55,g,51,g,6,g,0,g,0,g,1,g,5,g
139,johnnys pizza house,personal bacon cheeseburger pizza,47,g,125,mg,1630,g,86,g,51,g,19,g,1,g,4,g,13,g
140,johnnys pizza house,personal bacon chicken ranchero pizza,64,g,120,mg,1640,g,81,g,48,g,20,g,0.5,g,2,g,9,g
141,johnnys pizza house,personal bbq chicken pizza,37,g,110,mg,2050,g,112,g,49,g,15,g,0.5,g,4,g,38,g
142,johnnys pizza house,personal buffalo chicken pizza,38,g,110,mg,3680,g,81,g,48,g,16,g,1,g,2,g,10,g
143,johnnys pizza house,personal cheese pizza original crust regular sauce,25,g,45,mg,1110,g,83,g,33,g,10,g,0,g,4,g,12,g
144,johnnys pizza house,personal hog heaven pizza,45,g,125,mg,2610,g,85,g,57,g,17,g,0,g,4,g,13,g
145,johnnys pizza house,personal maui wowie pizza,36,g,125,mg,2720,g,88,g,61,g,14,g,0,g,4,g,17,g
146,johnnys pizza house,personal mighty meaty pizza,52,g,150,mg,2590,g,84,g,63,g,20,g,0.5,g,4,g,13,g
147,johnnys pizza house,personal pepperoni power pizza,61,g,130,mg,2390,g,85,g,57,g,25,g,1,g,4,g,13,g
148,johnnys pizza house,personal sweep the kitchen pizza,49,g,115,mg,2310,g,89,g,53,g,18,g,0.5,g,6,g,14,g
149,johnnys pizza house,personal sweep the swamp pizza lto,31,g,115,mg,2610,g,90,g,45,g,12,g,0,g,5,g,15,g
150,johnnys pizza house,personal veg out pizza,28,g,45,mg,1420,g,88,g,35,g,10,g,0,g,6,g,14,g
151,johnnys pizza house,pitcher bud light 60 fl oz,0,g,0,mg,55,g,23,g,4,g,0,g,0,g,0,g,0,g
152,johnnys pizza house,pitcher budweiser 60 fl oz,0,g,0,mg,55,g,53,g,6,g,0,g,0,g,0,g,0,g
153,johnnys pizza house,pitcher coors 60 fl oz,0,g,0,mg,55,g,57,g,6,g,0,g,0,g,0,g,54,g
154,johnnys pizza house,pitcher michelob 60 fl oz,0,g,0,mg,45,g,67,g,6,g,0,g,0,g,0,g,0,g
155,johnnys pizza house,pitcher michelob ultra 60 fl oz,0,g,0,mg,55,g,13,g,3,g,0,g,0,g,0,g,0,g
156,johnnys pizza house,pitcher miller 60 fl oz,0,g,0,mg,35,g,66,g,5,g,0,g,0,g,0,g,0,g
157,johnnys pizza house,pitcher miller light 60 fl oz,0,g,0,mg,25,g,16,g,3,g,0,g,0,g,0,g,0,g
158,johnnys pizza house,pizza sauce 3 fl oz,0.5,g,0,mg,530,g,8,g,2,g,0,g,0,g,2,g,5,g
159,johnnys pizza house,salad bar baby carrot 1 each,0,g,0,mg,10,g,1,g,0,g,0,g,0,g,0,g,1,g
160,johnnys pizza house,salad bar bacon bits 1 tbsp,2,g,0,mg,125,g,2,g,2,g,0,g,0,g,1,g,0,g
161,johnnys pizza house,salad bar balsamic dressing 1 ladle,5,g,0,mg,270,g,7,g,0,g,0.5,g,0,g,0,g,6,g
162,johnnys pizza house,salad bar bell peppers 1 4 cup,0,g,0,mg,0,g,2,g,0,g,0,g,0,g,1,g,1,g
163,johnnys pizza house,salad bar black olives 1 tbsp,1,g,0,mg,60,g,1,g,0,g,0,g,0,g,0,g,0,g
164,johnnys pizza house,salad bar blue cheese dressing 1 ladle,22,g,20,mg,340,g,1,g,1,g,4.5,g,0,g,0,g,1,g
165,johnnys pizza house,salad bar broccoli 1 4 cup,0,g,0,mg,0,g,1,g,1,g,0,g,0,g,0,g,0,g
166,johnnys pizza house,salad bar cheddar cheese 1 tbsp,2,g,5,mg,45,g,0,g,2,g,1.5,g,0,g,0,g,0,g
167,johnnys pizza house,salad bar cherry tomato 1 each,0,g,0,mg,0,g,1,g,0,g,0,g,0,g,0,g,0,g
168,johnnys pizza house,salad bar club crackers 1 pack,1.5,g,0,mg,50,g,5,g,1,g,0,g,0,g,0,g,1,g
169,johnnys pizza house,salad bar croutons 1 tbsp,0,g,0,mg,30,g,2,g,0,g,0,g,0,g,0,g,0,g
170,johnnys pizza house,salad bar cucumbers 1 4 cup,0,g,0,mg,0,g,1,g,0,g,0,g,0,g,0,g,0,g
171,johnnys pizza house,salad bar diced eggs 1 tbsp,1,g,30,mg,10,g,0,g,1,g,0,g,0,g,0,g,0,g
172,johnnys pizza house,salad bar diced ham 1 oz,0.5,g,15,mg,280,g,0,g,5,g,0,g,0,g,0,g,0,g
173,johnnys pizza house,salad bar diced peaches 1 tbsp,0,g,0,mg,0,g,2,g,0,g,0,g,0,g,0,g,2,g
174,johnnys pizza house,salad bar diced tomatoes 1 4 cup,0,g,0,mg,0,g,2,g,0,g,0,g,0,g,1,g,1,g
175,johnnys pizza house,salad bar grape tomatoes 1 each,0,g,0,mg,0,g,1,g,0,g,0,g,0,g,0,g,0,g
176,johnnys pizza house,salad bar green olives 1 tbsp,1.5,g,0,mg,140,g,0,g,0,g,0,g,0,g,0,g,0,g
177,johnnys pizza house,salad bar iceberg lettuce 1 cup,0,g,0,mg,5,g,2,g,1,g,0,g,0,g,1,g,1,g
178,johnnys pizza house,salad bar iceberg lettuce mix 1 cup,0,g,0,mg,10,g,3,g,1,g,0,g,0,g,1,g,1,g
179,johnnys pizza house,salad bar iceberg romaine lettuce mix 1 cup,0,g,0,mg,5,g,2,g,0,g,0,g,0,g,0,g,1,g
180,johnnys pizza house,salad bar italian dressing 1 ladle,14,g,0,mg,280,g,4,g,0,g,2,g,0,g,0,g,2,g
181,johnnys pizza house,salad bar kosher pickle spear 1 each,0,g,0,mg,180,g,1,g,0,g,0,g,0,g,0,g,0,g
182,johnnys pizza house,salad bar mushrooms 1 4 cup,0,g,0,mg,0,g,1,g,1,g,0,g,0,g,0,g,0,g
183,johnnys pizza house,salad bar pickled okra 1 each,0,g,0,mg,210,g,0,g,0,g,0,g,0,g,0,g,0,g
184,johnnys pizza house,salad bar radishes 1 4 cup,0,g,0,mg,10,g,1,g,0,g,0,g,0,g,0,g,1,g
185,johnnys pizza house,salad bar ranch dressing 1 ladle,16,g,5,mg,250,g,1,g,0,g,2.5,g,0,g,0,g,0,g
186,johnnys pizza house,salad bar red onion 1 4 cup,0,g,0,mg,0,g,3,g,0,g,0,g,0,g,0,g,1,g
187,johnnys pizza house,salad bar saltine crackers 1 each,0,g,0,mg,40,g,2,g,1,g,0,g,0,g,0,g,0,g
188,johnnys pizza house,salad bar shredded carrots 1 4 cup,0,g,0,mg,20,g,3,g,0,g,0,g,0,g,1,g,1,g
189,johnnys pizza house,salad bar spinach 1 4 cup,0,g,0,mg,5,g,0,g,0,g,0,g,0,g,0,g,0,g
190,johnnys pizza house,salad bar sunflower seeds 1 tbsp,4.5,g,0,mg,0,g,2,g,2,g,0.5,g,0,g,1,g,0,g
191,johnnys pizza house,salad bar thousand island dressing 1 ladle,17,g,15,mg,440,g,9,g,0,g,2.5,g,0,g,0,g,7,g
192,johnnys pizza house,small bacon cheeseburger pizza,76,g,200,mg,2540,g,135,g,83,g,31,g,1.5,g,6,g,20,g
193,johnnys pizza house,small bacon chicken ranchero pizza,99,g,200,mg,2660,g,130,g,79,g,32,g,1,g,4,g,15,g
194,johnnys pizza house,small bbq chicken pizza,63,g,185,mg,3210,g,171,g,80,g,26,g,1,g,5,g,53,g
195,johnnys pizza house,small buffalo chicken pizza,64,g,185,mg,5390,g,129,g,79,g,26,g,1.5,g,4,g,15,g
196,johnnys pizza house,small cheese pizza original crust regular sauce,41,g,75,mg,1690,g,131,g,54,g,16,g,0,g,6,g,19,g
197,johnnys pizza house,small fountain coke 12 fl oz,0,g,0,mg,45,g,39,g,0,g,0,g,0,g,0,g,39,g
198,johnnys pizza house,small fountain coke zero 12 fl oz,0,g,0,mg,40,g,0,g,0,g,0,g,0,g,0,g,0,g
199,johnnys pizza house,small fountain diet coke 12 fl oz,0,g,0,mg,40,g,0,g,0,g,0,g,0,g,0,g,0,g
200,johnnys pizza house,small fountain diet dr pepper 12 fl oz,0,g,0,mg,55,g,0,g,0,g,0,g,0,g,0,g,0,g
201,johnnys pizza house,small fountain dr pepper 12 fl oz,0,g,0,mg,55,g,41,g,0,g,0,g,0,g,0,g,41,g
202,johnnys pizza house,small fountain orange fanta 12 fl oz,0,g,0,mg,60,g,45,g,0,g,0,g,0,g,0,g,44,g
203,johnnys pizza house,small fountain pink lemonade 12 fl oz,0,g,0,mg,105,g,43,g,0,g,0,g,0,g,0,g,41,g
204,johnnys pizza house,small fountain powderade mountain berry blast 12 fl oz,0,g,0,mg,150,g,21,g,0,g,0,g,0,g,0,g,21,g
205,johnnys pizza house,small fountain root beer 12 fl oz,0,g,0,mg,70,g,45,g,0,g,0,g,0,g,0,g,45,g
206,johnnys pizza house,small fountain sprite 12 fl oz,0,g,0,mg,35,g,39,g,0,g,0,g,0,g,0,g,39,g
207,johnnys pizza house,small fountain strawberry fanta 12 fl oz,0,g,0,mg,45,g,48,g,0,g,0,g,0,g,0,g,48,g
208,johnnys pizza house,small fountain sweet tea 12 fl oz,0,g,0,mg,10,g,49,g,0,g,0,g,0,g,0,g,48,g
209,johnnys pizza house,small fountain unsweetened iced tea 12 fl oz,0,g,0,mg,10,g,1,g,0,g,0,g,0,g,0,g,0,g
210,johnnys pizza house,small hog heaven pizza,74,g,205,mg,4260,g,135,g,94,g,27,g,0,g,6,g,20,g
211,johnnys pizza house,small maui wowie pizza,60,g,200,mg,4300,g,139,g,100,g,23,g,0,g,6,g,25,g
212,johnnys pizza house,small mighty meaty pizza,84,g,240,mg,4210,g,133,g,103,g,32,g,1,g,6,g,19,g
213,johnnys pizza house,small peach puddin pizza 1 slice,15,g,0,mg,480,g,48,g,3,g,3,g,1.5,g,1,g,24,g
214,johnnys pizza house,small pepperoni power pizza,99,g,215,mg,3700,g,135,g,92,g,41,g,1.5,g,6,g,19,g
215,johnnys pizza house,small pizza topping anchovies,3,g,25,mg,1040,g,0,g,8,g,0.5,g,0,g,0,g,0,g
216,johnnys pizza house,small pizza topping andouille sausage,20,g,50,mg,940,g,3,g,10,g,6,g,0,g,0,g,1,g
217,johnnys pizza house,small pizza topping bacon,24,g,60,mg,1310,g,1,g,21,g,8,g,0,g,0,g,0,g
218,johnnys pizza house,small pizza topping bell pepper,0,g,0,mg,0,g,2,g,0,g,0,g,0,g,1,g,1,g
219,johnnys pizza house,small pizza topping black olives,12,g,0,mg,830,g,7,g,1,g,1.5,g,0,g,4,g,0,g
220,johnnys pizza house,small pizza topping cheddar cheese,46,g,135,mg,890,g,6,g,34,g,26,g,1.5,g,1,g,0,g
221,johnnys pizza house,small pizza topping chicken,2,g,45,mg,240,g,1,g,17,g,0.5,g,0,g,0,g,0,g
222,johnnys pizza house,small pizza topping crawfish lto,1,g,90,mg,1000,g,0,g,11,g,0,g,0,g,0,g,0,g
223,johnnys pizza house,small pizza topping diced tomatoes,0,g,0,mg,5,g,4,g,1,g,0,g,0,g,1,g,3,g
224,johnnys pizza house,small pizza topping green olives,17,g,0,mg,1760,g,4,g,1,g,2.5,g,0,g,4,g,1,g
225,johnnys pizza house,small pizza topping ham,1.5,g,25,mg,560,g,1,g,10,g,0,g,0,g,0,g,0,g
226,johnnys pizza house,small pizza topping hamburger,11,g,55,mg,50,g,0,g,16,g,4.5,g,0,g,0,g,0,g
227,johnnys pizza house,small pizza topping jalapenos,0.5,g,0,mg,950,g,3,g,1,g,0,g,0,g,1,g,1,g
228,johnnys pizza house,small pizza topping mushroom,0,g,0,mg,5,g,4,g,4,g,0,g,0,g,1,g,2,g
229,johnnys pizza house,small pizza topping onion,0,g,0,mg,0,g,5,g,1,g,0,g,0,g,1,g,2,g
230,johnnys pizza house,small pizza topping pepperoni,25,g,55,mg,900,g,0,g,11,g,10,g,0.5,g,0,g,0,g
231,johnnys pizza house,small pizza topping pineapple,0,g,0,mg,0,g,8,g,1,g,0,g,0,g,1,g,8,g
232,johnnys pizza house,small pizza topping sausage,19,g,45,mg,380,g,0,g,9,g,7,g,0,g,0,g,0,g
233,johnnys pizza house,small pizza topping shrimp lto,0,g,70,mg,1220,g,1,g,11,g,0,g,0,g,0,g,1,g
234,johnnys pizza house,small pizza topping taste of crab lto,0,g,15,mg,1510,g,10,g,5,g,0,g,0,g,0,g,4,g
235,johnnys pizza house,small pizza extra sauce,1,g,0,mg,960,g,15,g,3,g,0,g,0,g,5,g,8,g
236,johnnys pizza house,small pizza lite sauce,0,g,0,mg,320,g,5,g,1,g,0,g,0,g,2,g,3,g
237,johnnys pizza house,small pizza thick crust,20,g,0,mg,220,g,196,g,25,g,1.5,g,0.5,g,4,g,21,g
238,johnnys pizza house,small pizza thin crust,9,g,0,mg,95,g,87,g,11,g,0.5,g,0,g,2,g,9,g
239,johnnys pizza house,small sweep the kitchen pizza,77,g,180,mg,3610,g,141,g,84,g,29,g,1,g,9,g,22,g
240,johnnys pizza house,small sweep the swamp pizza lto,52,g,170,mg,3810,g,141,g,71,g,20,g,0,g,7,g,23,g
241,johnnys pizza house,small veg out pizza,46,g,75,mg,2170,g,140,g,57,g,17,g,0,g,9,g,22,g
242,johnnys pizza house,sprite 2 liter bottle,0,g,0,mg,190,g,220,g,0,g,0,g,0,g,0,g,220,g
243,johnnys pizza house,sweet tea 1 gallon,0,g,0,mg,120,g,526,g,0,g,0,g,0,g,0,g,514,g
244,johnnys pizza house,unsweetened iced tea 1 gallon,0,g,0,mg,115,g,11,g,0,g,0,g,0,g,0,g,0,g
245,johnnys pizza house,veg out flip,18,g,25,mg,870,g,80,g,22,g,5,g,0,g,3,g,10,g
246,johnnys pizza house,wing sauce bbq sauce 1 5 fl oz,0,g,0,mg,430,g,17,g,1,g,0,g,0,g,1,g,15,g
247,johnnys pizza house,wing sauce garlic parmesan sauce 1 5 fl oz,13,g,0,mg,720,g,3,g,1,g,2,g,0,g,1,g,1,g
248,johnnys pizza house,wing sauce hot buffalo sauce 1 5 fl oz,0.5,g,0,mg,1310,g,1,g,0,g,0,g,0,g,0,g,0,g
249,johnnys pizza house,wing sauce ranch dressing 4 fl oz,48,g,20,mg,760,g,4,g,0,g,8,g,0,g,0,g,0,g
250,johnnys pizza house,wing sauce sweet and tangy sauce sweet baby 1 5 fl oz,1,g,0,mg,610,g,29,g,1,g,0,g,0,g,0,g,26,g
251,jreck subs,american cheese half sub,5,g,10,mg,180,g,1,g,3,g,3,g,0,g,0,g,0,g
252,jreck subs,animal crackers,4,g,0,mg,135,g,22,g,2,g,2,g,0,g,1,g,7,g
253,jreck subs,apple and eve juice power punch fruitable,0,g,0,mg,15,g,14,g,0,g,0,g,0,g,0,g,12,g
254,jreck subs,apple and eve juice white grape raspberry,0,g,0,mg,15,g,21,g,0,g,0,g,0,g,0,g,18,g
255,jreck subs,apple pastry mini bites,2,g,0,mg,80,g,9,g,1,g,1,g,0,g,1,g,3,g
256,jreck subs,asiago cheese roll half sub,4,g,5,mg,390,g,27,g,7,g,2,g,0,g,0,g,2,g
257,jreck subs,baked lays bbq chips,3,g,0,mg,210,g,25,g,2,g,1,g,0,g,2,g,3,g
258,jreck subs,baked lays regular chips,2,g,0,mg,150,g,26,g,2,g,0,g,0,g,2,g,2,g
259,jreck subs,brioche roll half sub,2,g,0,mg,330,g,33,g,2,g,0,g,0,g,0,g,4,g
260,jreck subs,broccoli and cheddar bites battered,23,g,15,mg,800,g,32,g,9,g,7,g,0,g,5,g,5,g
261,jreck subs,brownie,11,g,15,mg,140,g,34,g,2,g,3,g,0,g,1,g,15,g
262,jreck subs,bug bite cinnamon graham crackers,4,g,0,mg,115,g,21,g,2,g,1,g,0,g,1,g,8,g
263,jreck subs,cauliflower battered,21,g,0,mg,690,g,36,g,5,g,3,g,0,g,2,g,3,g
264,jreck subs,cheese ravioli breaded 7 pieces,19,g,55,mg,510,g,47,g,12,g,6,g,0,g,2,g,4,g
265,jreck subs,cheetos crunchy cheese snacks,20,g,0,mg,500,g,26,g,4,g,3,g,0,g,2,g,2,g
266,jreck subs,chicken breast bites lightly breaded,16,g,90,mg,570,g,17,g,28,g,2,g,0,g,0,g,0,g
