,Restaurant Name,Food Name,Total Fat Amount,Total Fat Unit,Cholesterol Amount,Cholesterol Unit,Sodium Amount,Sodium Unit,Total Carbohydrate Amount,Total Carbohydrate Unit,Protein Amount,Protein Unit,Saturated Fat Amount,Saturated Fat Unit,Trans Fat Amount,Trans Fat Unit,Dietary Fiber Amount,Dietary Fiber Unit,Sugars Amount,Sugars Unit
267,jreck subs,chicken tenders 4 piece,20,g,60,mg,1280,g,28,g,32,g,3,g,0,g,2,g,0,g
268,jreck subs,chocolate milk low fat pint,6,g,20,mg,40,g,62,g,16,g,4,g,0,g,0,g,58,g
269,jreck subs,chocolate milk half pint,8,g,30,mg,150,g,26,g,8,g,5,g,0,g,2,g,24,g
270,jreck subs,clam strips,23,g,15,mg,930,g,39,g,9,g,3,g,0,g,1,g,4,g
271,jreck subs,cookie butter sugar,7,g,15,mg,140,g,22,g,2,g,4,g,0,g,0,g,12,g
272,jreck subs,cookie carnival,7,g,10,mg,120,g,22,g,2,g,3,g,0,g,1,g,14,g
273,jreck subs,cookie chocolate chip,8,g,10,mg,125,g,24,g,2,g,4,g,0,g,1,g,15,g
274,jreck subs,cookie chocolate chip pecan,9,g,10,mg,110,g,21,g,2,g,4,g,0,g,1,g,13,g
275,jreck subs,cookie double chocolate chip,9,g,10,mg,115,g,22,g,2,g,4,g,0,g,1,g,14,g
276,jreck subs,cookie oatmeal raisin,5,g,10,mg,125,g,21,g,2,g,4,g,0,g,1,g,12,g
277,jreck subs,cookie peanut butter,9,g,10,mg,160,g,19,g,3,g,4,g,0,g,1,g,11,g
278,jreck subs,cookie white chocolate macadamia,8,g,15,mg,120,g,21,g,2,g,4,g,0,g,0,g,13,g
279,jreck subs,corn nuggets battered,19,g,0,mg,600,g,48,g,5,g,2,g,0,g,3,g,12,g
280,jreck subs,crispy battered green beans,19,g,0,mg,1070,g,43,g,10,g,3,g,0,g,5,g,7,g
281,jreck subs,croutons,1,g,0,mg,95,g,5,g,1,g,0,g,0,g,0,g,1,g
282,jreck subs,doritos tortilla cool ranch chips,14,g,0,mg,320,g,32,g,4,g,2,g,0,g,4,g,2,g
283,jreck subs,doritos tortilla nacho cheese chips,14,g,0,mg,370,g,28,g,4,g,2,g,0,g,2,g,0,g
284,jreck subs,french fries,13,g,0,mg,430,g,38,g,3,g,3,g,0,g,3,g,0,g
285,jreck subs,frito corn chips,20,g,0,mg,340,g,30,g,4,g,3,g,0,g,2,g,2,g
286,jreck subs,garlic and dill roll half sub,3,g,0,mg,370,g,31,g,6,g,1,g,0,g,0,g,2,g
287,jreck subs,half sub dressings bbq sauce,0,g,0,mg,230,g,9,g,0,g,0,g,0,g,0,g,8,g
288,jreck subs,half sub dressings blue cheese,11,g,10,mg,180,g,1,g,1,g,2,g,0,g,0,g,1,g
289,jreck subs,half sub dressings buttermilk ranch,11,g,5,mg,210,g,1,g,0,g,2,g,0,g,0,g,1,g
290,jreck subs,half sub dressings cheddar cheese sauce,2,g,5,mg,180,g,2,g,1,g,1,g,0,g,0,g,1,g
291,jreck subs,half sub dressings chile sauce,0,g,0,mg,290,g,6,g,0,g,0,g,0,g,0,g,4,g
292,jreck subs,half sub dressings chipotle mayonnaise,13,g,5,mg,160,g,1,g,0,g,2,g,0,g,0,g,0,g
293,jreck subs,half sub dressings heinz ketchup pc packet,0,g,0,mg,85,g,3,g,0,g,0,g,0,g,0,g,2,g
294,jreck subs,half sub dressings heinz mustard pc packet,0,g,0,mg,85,g,0,g,1,g,0,g,0,g,0,g,0,g
295,jreck subs,half sub dressings honey mustard,7,g,5,mg,135,g,3,g,0,g,1,g,0,g,0,g,0,g
296,jreck subs,half sub dressings horseradish dijon,8,g,5,mg,150,g,4,g,0,g,1,g,0,g,0,g,4,g
297,jreck subs,half sub dressings hot sauce,0,g,0,mg,440,g,0,g,0,g,0,g,0,g,0,g,0,g
298,jreck subs,half sub dressings jreck italian dressing,13,g,0,mg,50,g,0,g,0,g,2,g,0,g,0,g,0,g
299,jreck subs,half sub dressings jreck mayonnaise,8,g,5,mg,40,g,4,g,0,g,1,g,0,g,0,g,0,g
300,jreck subs,half sub dressings jreck spaghetti sauce,0,g,0,mg,125,g,3,g,1,g,0,g,0,g,1,g,2,g
301,jreck subs,half sub dressings kens balsamic vinaigrette pc pouch,17,g,0,mg,330,g,4,g,0,g,3,g,0,g,0,g,3,g
302,jreck subs,half sub dressings kens blue cheese pc pouch,23,g,15,mg,490,g,2,g,1,g,4,g,0,g,0,g,2,g
303,jreck subs,half sub dressings kens italian lite pc pouch,4,g,0,mg,530,g,3,g,0,g,1,g,0,g,0,g,3,g
304,jreck subs,half sub dressings kens mayonnaise pc packet,10,g,10,mg,70,g,0,g,0,g,2,g,0,g,0,g,0,g
305,jreck subs,half sub dressings kens ranch fat free pc pouch,0,g,0,mg,550,g,13,g,0,g,0,g,0,g,1,g,5,g
306,jreck subs,half sub dressings kens ranch pc pouch,28,g,10,mg,240,g,2,g,1,g,4,g,0,g,0,g,2,g
307,jreck subs,half sub dressings kens raspberry vinaigrette ff pc pouch,0,g,0,mg,110,g,12,g,0,g,0,g,0,g,0,g,10,g
308,jreck subs,half sub dressings kens thousand islands pc pouch,18,g,20,mg,370,g,6,g,0,g,3,g,0,g,0,g,4,g
309,jreck subs,half sub dressings ketchup,0,g,0,mg,160,g,5,g,0,g,0,g,0,g,0,g,4,g
310,jreck subs,half sub dressings mustard,0,g,0,mg,150,g,0,g,0,g,0,g,0,g,0,g,0,g
311,jreck subs,half sub dressings russian dressing,9,g,5,mg,210,g,4,g,0,g,1,g,0,g,0,g,3,g
312,jreck subs,half sub dressings spicy mustard,0,g,0,mg,180,g,0,g,0,g,0,g,0,g,0,g,0,g
313,jreck subs,half sub dressings steak sauce,0,g,0,mg,110,g,2,g,0,g,0,g,0,g,0,g,1,g
314,jreck subs,half sub dressings tarter sauce,8,g,5,mg,120,g,2,g,0,g,1,g,0,g,0,g,2,g
315,jreck subs,half sub dressings teriyaki sauce,0,g,0,mg,290,g,9,g,1,g,0,g,0,g,0,g,8,g
316,jreck subs,half sub extra bacon,8,g,15,mg,380,g,0,g,5,g,3,g,0,g,0,g,0,g
317,jreck subs,half sub protein bacon blt,13,g,25,mg,630,g,0,g,8,g,5,g,0,g,0,g,0,g
318,jreck subs,half sub protein bbq pork rib,23,g,65,mg,560,g,12,g,12,g,7,g,0,g,1,g,9,g
319,jreck subs,half sub protein bbq pulled pork with sauce,5,g,45,mg,450,g,12,g,13,g,2,g,0,g,1,g,10,g
320,jreck subs,half sub protein beef patty cheeseburger sub,14,g,70,mg,70,g,0,g,20,g,5,g,1,g,0,g,0,g
321,jreck subs,half sub protein breaded chicken hoagie,19,g,45,mg,680,g,16,g,12,g,4,g,0,g,2,g,1,g
322,jreck subs,half sub protein breaded clam strips clam roll,23,g,15,mg,930,g,39,g,9,g,3,g,0,g,1,g,4,g
323,jreck subs,half sub protein breaded eggplant,5,g,0,mg,400,g,18,g,3,g,0,g,0,g,3,g,2,g
324,jreck subs,half sub protein breaded veal,25,g,45,mg,690,g,20,g,15,g,10,g,1,g,2,g,1,g
325,jreck subs,half sub protein cheese sub american,15,g,30,mg,540,g,3,g,9,g,9,g,0,g,0,g,0,g
326,jreck subs,half sub protein cheese sub provolone,12,g,25,mg,320,g,0,g,9,g,6,g,0,g,0,g,0,g
327,jreck subs,half sub protein cheese sub swiss,12,g,40,mg,90,g,0,g,12,g,9,g,0,g,0,g,0,g
328,jreck subs,half sub protein chicken salad,33,g,55,mg,220,g,1,g,9,g,6,g,0,g,0,g,0,g
329,jreck subs,half sub protein chicken stir fry,1,g,40,mg,530,g,2,g,16,g,0,g,0,g,0,g,0,g
330,jreck subs,half sub protein cooked salami,11,g,40,mg,550,g,2,g,6,g,4,g,0,g,0,g,0,g
331,jreck subs,half sub protein croghan bologna,6,g,40,mg,390,g,2,g,9,g,3,g,0,g,0,g,0,g
332,jreck subs,half sub protein deli corn beef,2,g,5,mg,320,g,1,g,11,g,1,g,0,g,0,g,0,g
333,jreck subs,half sub protein deli ham,2,g,30,mg,670,g,2,g,9,g,1,g,0,g,0,g,2,g
334,jreck subs,half sub protein deli roast beef,2,g,25,mg,510,g,0,g,10,g,1,g,0,g,0,g,0,g
335,jreck subs,half sub protein deli turkey,1,g,20,mg,440,g,1,g,9,g,0,g,0,g,0,g,0,g
336,jreck subs,half sub protein egg salad,23,g,265,mg,160,g,1,g,1,g,5,g,0,g,0,g,1,g
337,jreck subs,half sub protein fish battered pollock,12,g,35,mg,370,g,15,g,9,g,2,g,0,g,0,g,0,g
338,jreck subs,half sub protein grilled chicken,5,g,50,mg,530,g,3,g,14,g,2,g,0,g,0,g,2,g
339,jreck subs,half sub protein hard salami,18,g,45,mg,810,g,0,g,11,g,8,g,0,g,0,g,0,g
340,jreck subs,half sub protein hot ham capicola,2,g,20,mg,480,g,4,g,7,g,1,g,0,g,0,g,3,g
341,jreck subs,half sub protein italian sub meat mix,16,g,40,mg,850,g,2,g,12,g,7,g,0,g,0,g,2,g
342,jreck subs,half sub protein meatball,16,g,50,mg,520,g,4,g,14,g,6,g,1,g,1,g,0,g
343,jreck subs,half sub protein popcorn chicken,17,g,25,mg,720,g,16,g,16,g,3,g,0,g,2,g,1,g
344,jreck subs,half sub protein regular sub meat mix,10,g,35,mg,590,g,1,g,7,g,3,g,0,g,0,g,1,g
345,jreck subs,half sub protein sandwich pepperoni,19,g,45,mg,840,g,2,g,11,g,8,g,0,g,0,g,2,g
346,jreck subs,half sub protein sausage,26,g,70,mg,1000,g,5,g,14,g,9,g,0,g,0,g,4,g
347,jreck subs,half sub protein seafood salad,27,g,25,mg,590,g,11,g,4,g,5,g,0,g,0,g,3,g
348,jreck subs,half sub protein steak,9,g,35,mg,210,g,2,g,12,g,4,g,0,g,0,g,0,g
349,jreck subs,half sub protein tuna salad,35,g,45,mg,320,g,0,g,9,g,6,g,0,g,0,g,0,g
350,jreck subs,half sub protein vegetarian american,10,g,20,mg,360,g,2,g,6,g,6,g,0,g,0,g,0,g
351,jreck subs,half sub protein vegetarian provolone,8,g,20,mg,220,g,0,g,6,g,4,g,0,g,0,g,0,g
352,jreck subs,half sub protein vegetarian swiss,8,g,25,mg,60,g,0,g,8,g,6,g,0,g,0,g,0,g
353,jreck subs,half sub toppings chopped cherry peppers,0,g,0,mg,100,g,0,g,0,g,0,g,0,g,0,g,0,g
354,jreck subs,half sub toppings grated parmesan cheese,0,g,0,mg,25,g,0,g,0,g,0,g,0,g,0,g,0,g
355,jreck subs,half sub toppings iceberg lettuce shredded,0,g,0,mg,0,g,1,g,0,g,0,g,0,g,0,g,1,g
356,jreck subs,half sub toppings mushrooms heat processed,0,g,0,mg,130,g,1,g,0,g,0,g,0,g,1,g,0,g
357,jreck subs,half sub toppings onion sliced,0,g,0,mg,0,g,1,g,0,g,0,g,0,g,0,g,1,g
358,jreck subs,half sub toppings pickle shreddies,0,g,0,mg,130,g,0,g,0,g,0,g,0,g,0,g,0,g
359,jreck subs,half sub toppings red and green peppers,0,g,0,mg,0,g,2,g,0,g,0,g,0,g,0,g,1,g
360,jreck subs,half sub toppings sauerkraut,0,g,0,mg,150,g,2,g,0,g,0,g,0,g,2,g,0,g
361,jreck subs,half sub toppings sliced banana pepper,0,g,0,mg,95,g,0,g,0,g,0,g,0,g,0,g,0,g
362,jreck subs,half sub toppings sliced olives,1,g,0,mg,70,g,1,g,0,g,0,g,0,g,0,g,0,g
363,jreck subs,half sub toppings spinach whole leaf,0,g,0,mg,5,g,0,g,0,g,0,g,0,g,0,g,0,g
364,jreck subs,half sub toppings tomato,0,g,0,mg,0,g,1,g,0,g,0,g,0,g,0,g,1,g
365,jreck subs,half sub bbq pork rib with bbq sauce,25,g,65,mg,1180,g,61,g,20,g,8,g,0,g,3,g,20,g
366,jreck subs,half sub bbq pulled pork with bbq sauce,7,g,45,mg,940,g,52,g,21,g,3,g,0,g,3,g,13,g
367,jreck subs,half sub blt bacon lettuce tomato mayo,24,g,35,mg,1240,g,47,g,16,g,8,g,0,g,2,g,5,g
368,jreck subs,half sub breaded chicken hoagie,21,g,45,mg,1170,g,56,g,20,g,5,g,0,g,4,g,4,g
369,jreck subs,half sub breaded clam strips clam roll,25,g,15,mg,1420,g,79,g,17,g,4,g,0,g,3,g,7,g
370,jreck subs,half sub breaded eggplant parm,7,g,0,mg,1010,g,61,g,12,g,1,g,0,g,6,g,7,g
371,jreck subs,half sub breaded veal parm,27,g,45,mg,1300,g,63,g,24,g,11,g,1,g,5,g,6,g
372,jreck subs,half sub cheese burger sub american cheese,20,g,80,mg,670,g,42,g,31,g,8,g,1,g,2,g,5,g
373,jreck subs,half sub cheese sub,12,g,20,mg,850,g,45,g,14,g,7,g,0,g,2,g,6,g
374,jreck subs,half sub chicken salad,35,g,55,mg,710,g,44,g,17,g,7,g,0,g,2,g,6,g
375,jreck subs,half sub chicken stir fry,3,g,40,mg,1020,g,42,g,24,g,1,g,0,g,2,g,3,g
376,jreck subs,half sub cooked salami,13,g,40,mg,1050,g,45,g,14,g,5,g,0,g,2,g,6,g
377,jreck subs,half sub corned beef rueben swiss russian,13,g,15,mg,1090,g,47,g,20,g,4,g,0,g,4,g,6,g
378,jreck subs,half sub croghan bologna,8,g,40,mg,880,g,45,g,17,g,4,g,0,g,2,g,6,g
379,jreck subs,half sub deli corned beef,4,g,5,mg,810,g,44,g,19,g,2,g,0,g,2,g,6,g
380,jreck subs,half sub deli ham,4,g,30,mg,1160,g,45,g,17,g,2,g,0,g,2,g,8,g
381,jreck subs,half sub deli roast beef,4,g,25,mg,1000,g,43,g,18,g,2,g,0,g,2,g,6,g
382,jreck subs,half sub deli turkey,3,g,20,mg,930,g,44,g,17,g,1,g,0,g,2,g,6,g
383,jreck subs,half sub egg salad,25,g,265,mg,660,g,44,g,9,g,6,g,0,g,2,g,7,g
384,jreck subs,half sub fish battered pollock,14,g,35,mg,860,g,55,g,17,g,3,g,0,g,2,g,3,g
385,jreck subs,half sub grilled chicken,7,g,50,mg,1020,g,43,g,22,g,3,g,0,g,4,g,5,g
386,jreck subs,half sub hard salami,20,g,45,mg,1300,g,43,g,19,g,9,g,0,g,2,g,6,g
387,jreck subs,half sub hot ham capicola,4,g,20,mg,980,g,47,g,15,g,2,g,0,g,2,g,9,g
388,jreck subs,half sub italian sub,18,g,40,mg,1340,g,45,g,20,g,8,g,0,g,2,g,8,g
389,jreck subs,half sub meatball,18,g,50,mg,1130,g,47,g,23,g,7,g,1,g,4,g,5,g
390,jreck subs,half sub pizza sub,21,g,45,mg,1450,g,45,g,20,g,9,g,0,g,3,g,7,g
391,jreck subs,half sub popcorn chicken,19,g,25,mg,1210,g,56,g,24,g,4,g,0,g,4,g,4,g
392,jreck subs,half sub regular sub,12,g,35,mg,1090,g,44,g,15,g,4,g,0,g,2,g,7,g
393,jreck subs,half sub sandwich pepperoni,21,g,45,mg,1330,g,45,g,19,g,9,g,0,g,2,g,8,g
394,jreck subs,half sub sausage and peppers,37,g,80,mg,1610,g,54,g,22,g,12,g,0,g,2,g,10,g
395,jreck subs,half sub seafood salad,29,g,25,mg,1090,g,54,g,12,g,6,g,0,g,2,g,9,g
396,jreck subs,half sub steak,11,g,35,mg,700,g,42,g,20,g,5,g,0,g,2,g,3,g
397,jreck subs,half sub super steak,24,g,80,mg,1020,g,44,g,35,g,11,g,0,g,2,g,3,g
398,jreck subs,half sub tuna salad,37,g,45,mg,810,g,43,g,17,g,7,g,0,g,2,g,6,g
399,jreck subs,half sub vegetarian,7,g,10,mg,670,g,44,g,11,g,4,g,0,g,2,g,6,g
400,jreck subs,jalapeno cheddar potato bites breaded,20,g,20,mg,960,g,35,g,9,g,6,g,0,g,2,g,0,g
401,jreck subs,jalapeno roll half sub,2,g,0,mg,510,g,39,g,8,g,1,g,0,g,2,g,3,g
402,jreck subs,large drink diet dr pepper,0,g,0,mg,180,g,0,g,0,g,0,g,0,g,0,g,0,g
403,jreck subs,large drink diet mountain dew,0,g,0,mg,140,g,1,g,0,g,0,g,0,g,0,g,1,g
404,jreck subs,large drink diet pepsi,0,g,0,mg,140,g,0,g,0,g,0,g,0,g,0,g,0,g
405,jreck subs,large drink diet pepsi caffeine free,0,g,0,mg,140,g,0,g,0,g,0,g,0,g,0,g,0,g
406,jreck subs,large drink dr pepper,0,g,0,mg,135,g,100,g,0,g,0,g,0,g,0,g,100,g
407,jreck subs,large drink gatorade lemon lime,0,g,0,mg,400,g,60,g,0,g,0,g,0,g,0,g,52,g
408,jreck subs,large drink gatorade orange,0,g,0,mg,450,g,60,g,0,g,0,g,0,g,0,g,57,g
409,jreck subs,large drink lipton tea brisk raspberry,0,g,0,mg,115,g,46,g,0,g,0,g,0,g,0,g,49,g
410,jreck subs,large drink lipton tea unsweaten no lem,0,g,0,mg,300,g,0,g,0,g,0,g,0,g,0,g,0,g
411,jreck subs,large drink mountain dew,0,g,0,mg,125,g,110,g,0,g,0,g,0,g,0,g,109,g
412,jreck subs,large drink mug root beer,0,g,0,mg,110,g,98,g,0,g,0,g,0,g,0,g,98,g
413,jreck subs,large drink pepsi cola,0,g,0,mg,80,g,104,g,0,g,0,g,0,g,0,g,103,g
414,jreck subs,large drink sierra mist,0,g,0,mg,80,g,101,g,0,g,0,g,0,g,0,g,101,g
415,jreck subs,large drink sobe life water yumberry,0,g,0,mg,115,g,0,g,0,g,0,g,0,g,0,g,0,g
416,jreck subs,large drink tropicana fruit punch,0,g,0,mg,90,g,113,g,0,g,0,g,0,g,0,g,112,g
417,jreck subs,large drink tropicana orange twister,0,g,0,mg,90,g,115,g,0,g,0,g,0,g,0,g,114,g
418,jreck subs,large drink tropicana pink lemonade,0,g,0,mg,390,g,100,g,0,g,0,g,0,g,0,g,100,g
419,jreck subs,large drink tropicana yellow lemonade,0,g,0,mg,390,g,100,g,0,g,0,g,0,g,0,g,100,g
420,jreck subs,lays bbq chips,14,g,0,mg,230,g,24,g,3,g,2,g,0,g,2,g,3,g
421,jreck subs,lays kettle cooked jalapeno,14,g,0,mg,200,g,24,g,3,g,2,g,0,g,2,g,2,g
422,jreck subs,lays kettle cooked mesquite bbq,12,g,0,mg,210,g,26,g,3,g,2,g,0,g,2,g,3,g
423,jreck subs,lays kettle cooked original,9,g,0,mg,200,g,29,g,3,g,2,g,0,g,3,g,2,g
424,jreck subs,lays kettle cooked salt and vinegar,14,g,0,mg,230,g,26,g,3,g,2,g,0,g,2,g,2,g
425,jreck subs,lays regular chips,15,g,0,mg,260,g,23,g,3,g,2,g,0,g,2,g,2,g
426,jreck subs,lays salt and vinegar chips,15,g,0,mg,330,g,23,g,3,g,2,g,0,g,2,g,2,g
427,jreck subs,lays sour cream and onion chips,15,g,0,mg,240,g,23,g,3,g,2,g,0,g,2,g,2,g
428,jreck subs,mac and cheese bites,27,g,0,mg,1490,g,35,g,14,g,8,g,0,g,0,g,0,g
429,jreck subs,medium drink diet dr pepper,0,g,0,mg,125,g,0,g,0,g,0,g,0,g,0,g,0,g
430,jreck subs,medium drink diet mountain dew,0,g,0,mg,95,g,1,g,0,g,0,g,0,g,0,g,1,g
431,jreck subs,medium drink diet pepsi,0,g,0,mg,100,g,0,g,0,g,0,g,0,g,0,g,0,g
432,jreck subs,medium drink diet pepsi caffeine free,0,g,0,mg,100,g,0,g,0,g,0,g,0,g,0,g,0,g
433,jreck subs,medium drink dr pepper,0,g,0,mg,95,g,70,g,0,g,0,g,0,g,0,g,70,g
434,jreck subs,medium drink gatorade lemon lime,0,g,0,mg,280,g,42,g,0,g,0,g,0,g,0,g,37,g
435,jreck subs,medium drink gatorade orange,0,g,0,mg,320,g,42,g,0,g,0,g,0,g,0,g,40,g
436,jreck subs,medium drink lipton tea brisk raspberry,0,g,0,mg,80,g,32,g,0,g,0,g,0,g,0,g,34,g
437,jreck subs,medium drink lipton tea unsweet no lem,0,g,0,mg,210,g,0,g,0,g,0,g,0,g,0,g,0,g
438,jreck subs,medium drink mountain dew,0,g,0,mg,90,g,77,g,0,g,0,g,0,g,0,g,77,g
439,jreck subs,medium drink mug root beer,0,g,0,mg,75,g,68,g,0,g,0,g,0,g,0,g,68,g
440,jreck subs,medium drink pepsi cola,0,g,0,mg,55,g,73,g,0,g,0,g,0,g,0,g,72,g
441,jreck subs,medium drink sierra mist,0,g,0,mg,60,g,71,g,0,g,0,g,0,g,0,g,71,g
442,jreck subs,medium drink sobe life water yumberry,0,g,0,mg,80,g,0,g,0,g,0,g,0,g,0,g,0,g
443,jreck subs,medium drink tropicana fruit punch,0,g,0,mg,60,g,79,g,0,g,0,g,0,g,0,g,79,g
444,jreck subs,medium drink tropicana orange twister,0,g,0,mg,60,g,80,g,0,g,0,g,0,g,0,g,80,g
445,jreck subs,medium drink tropicana pink lemonade,0,g,0,mg,270,g,70,g,0,g,0,g,0,g,0,g,70,g
446,jreck subs,medium drink tropicana yellow lemonade,0,g,0,mg,270,g,70,g,0,g,0,g,0,g,0,g,70,g
447,jreck subs,milk 2 half pint,5,g,20,mg,125,g,13,g,8,g,3,g,0,g,0,g,12,g
448,jreck subs,milk 2 pint,10,g,40,mg,25,g,26,g,16,g,6,g,0,g,0,g,24,g
449,jreck subs,mini sub roll half sub,2,g,0,mg,330,g,27,g,5,g,0,g,0,g,1,g,2,g
450,jreck subs,mini sub deli ham,3,g,15,mg,670,g,30,g,10,g,1,g,0,g,1,g,5,g
451,jreck subs,mini sub deli roast beef,3,g,15,mg,590,g,29,g,10,g,1,g,0,g,1,g,4,g
452,jreck subs,mini sub deli turkey,3,g,10,mg,550,g,29,g,10,g,0,g,0,g,1,g,4,g
453,jreck subs,mini sub meatball spaghetti sauce only,10,g,25,mg,650,g,31,g,13,g,3,g,1,g,2,g,3,g
454,jreck subs,mini sub seafood,16,g,15,mg,630,g,34,g,7,g,3,g,0,g,1,g,5,g
455,jreck subs,mini sub tuna,20,g,20,mg,490,g,29,g,10,g,3,g,0,g,1,g,4,g
456,jreck subs,motts apple juice,0,g,0,mg,0,g,15,g,0,g,0,g,0,g,0,g,15,g
457,jreck subs,motts applesauce snack pack,0,g,0,mg,0,g,24,g,0,g,0,g,0,g,1,g,22,g
458,jreck subs,mozz cheese sticks battered 4 sticks,24,g,40,mg,1160,g,36,g,16,g,9,g,0,g,2,g,8,g
459,jreck subs,mushrooms battered,21,g,0,mg,780,g,33,g,5,g,3,g,0,g,1,g,2,g
460,jreck subs,onion rings battered,21,g,0,mg,880,g,48,g,7,g,3,g,0,g,2,g,7,g
461,jreck subs,onion roll half sub,3,g,0,mg,310,g,34,g,5,g,1,g,0,g,1,g,9,g
462,jreck subs,oyster crackers,2,g,0,mg,85,g,11,g,1,g,1,g,0,g,0,g,0,g
463,jreck subs,pepper jack cheese half sub,6,g,25,mg,130,g,0,g,5,g,4,g,0,g,0,g,0,g
464,jreck subs,pickle chips battered,21,g,0,mg,850,g,20,g,2,g,7,g,0,g,3,g,0,g
465,jreck subs,pizza logs pepperoni and cheese 3 logs,35,g,60,mg,690,g,59,g,21,g,11,g,0,g,3,g,5,g
466,jreck subs,popcorn chicken,24,g,35,mg,1010,g,22,g,22,g,4,g,0,g,3,g,1,g
467,jreck subs,provolone cheese half sub,4,g,10,mg,110,g,0,g,3,g,2,g,0,g,0,g,0,g
468,jreck subs,salad with cheese only,8,g,20,mg,220,g,6,g,6,g,4,g,0,g,0,g,6,g
469,jreck subs,salad ham,12,g,80,mg,1560,g,10,g,24,g,6,g,0,g,0,g,10,g
470,jreck subs,salad ham turkey,11,g,70,mg,1330,g,9,g,24,g,5,g,0,g,0,g,8,g
471,jreck subs,salad roast beef,12,g,70,mg,1240,g,6,g,26,g,6,g,0,g,0,g,6,g
472,jreck subs,salad seafood,62,g,70,mg,1410,g,28,g,14,g,14,g,0,g,0,g,12,g
473,jreck subs,salad tuna,78,g,105,mg,850,g,6,g,24,g,16,g,0,g,0,g,6,g
474,jreck subs,salad turkey,10,g,60,mg,1100,g,8,g,24,g,4,g,0,g,0,g,6,g
475,jreck subs,saltines crackers,1,g,0,mg,60,g,4,g,0,g,0,g,0,g,0,g,0,g
476,jreck subs,schwans oreo cream pie wedge,13,g,5,mg,200,g,34,g,3,g,8,g,0,g,1,g,23,g
477,jreck subs,schwans reese peanut butter pie wedge,17,g,5,mg,250,g,32,g,5,g,9,g,0,g,1,g,23,g
478,jreck subs,seasoned loop fries,15,g,0,mg,670,g,38,g,3,g,2,g,0,g,3,g,2,g
479,jreck subs,small drink diet dr pepper,0,g,0,mg,70,g,0,g,0,g,0,g,0,g,0,g,0,g
480,jreck subs,small drink diet mountain dew,0,g,0,mg,55,g,0,g,0,g,0,g,0,g,0,g,0,g
481,jreck subs,small drink diet pepsi,0,g,0,mg,55,g,0,g,0,g,0,g,0,g,0,g,0,g
482,jreck subs,small drink diet pepsi caffeine free,0,g,0,mg,55,g,0,g,0,g,0,g,0,g,0,g,0,g
483,jreck subs,small drink dr pepper,0,g,0,mg,55,g,40,g,0,g,0,g,0,g,0,g,40,g
484,jreck subs,small drink gatorade lemon lime,0,g,0,mg,160,g,24,g,0,g,0,g,0,g,0,g,21,g
485,jreck subs,small drink gatorade orange,0,g,0,mg,180,g,24,g,0,g,0,g,0,g,0,g,23,g
486,jreck subs,small drink lipton tea brisk raspberry,0,g,0,mg,45,g,18,g,0,g,0,g,0,g,0,g,19,g
487,jreck subs,small drink lipton tea unsweaten no lem,0,g,0,mg,120,g,0,g,0,g,0,g,0,g,0,g,0,g
488,jreck subs,small drink mountain dew,0,g,0,mg,50,g,44,g,0,g,0,g,0,g,0,g,44,g
489,jreck subs,small drink mug root beer,0,g,0,mg,45,g,39,g,0,g,0,g,0,g,0,g,39,g
490,jreck subs,small drink pepsi cola,0,g,0,mg,30,g,41,g,0,g,0,g,0,g,0,g,41,g
491,jreck subs,small drink sierra mist,0,g,0,mg,35,g,41,g,0,g,0,g,0,g,0,g,41,g
492,jreck subs,small drink sobe life water yumberry,0,g,0,mg,45,g,0,g,0,g,0,g,0,g,0,g,0,g
493,jreck subs,small drink tropicana fruit punch,0,g,0,mg,35,g,45,g,0,g,0,g,0,g,0,g,45,g
494,jreck subs,small drink tropicana orange twister,0,g,0,mg,35,g,46,g,0,g,0,g,0,g,0,g,46,g
495,jreck subs,small drink tropicana pink lemonade,0,g,0,mg,160,g,40,g,0,g,0,g,0,g,0,g,40,g
496,jreck subs,small drink tropicana yellow lemonade,0,g,0,mg,160,g,40,g,0,g,0,g,0,g,0,g,40,g
497,jreck subs,smart food white cheddar popcorn,18,g,5,mg,510,g,25,g,5,g,4,g,0,g,4,g,4,g
498,jreck subs,soups beans with ham,1,g,5,mg,820,g,28,g,11,g,0,g,0,g,9,g,2,g
499,jreck subs,soups captains corn chowder,11,g,10,mg,1260,g,43,g,10,g,2,g,0,g,6,g,14,g
500,jreck subs,soups cheddar cauliflower,8,g,5,mg,1010,g,20,g,5,g,2,g,0,g,7,g,4,g
501,jreck subs,soups chicken and dumpling,10,g,55,mg,1360,g,27,g,13,g,4,g,0,g,4,g,6,g
502,jreck subs,soups chicken gumbo,3,g,15,mg,1210,g,17,g,8,g,1,g,0,g,3,g,5,g
503,jreck subs,soups chicken noodle,3,g,25,mg,1020,g,22,g,8,g,1,g,0,g,1,g,5,g
504,jreck subs,soups chicken with wild rice,12,g,40,mg,1070,g,20,g,18,g,3,g,0,g,5,g,5,g
505,jreck subs,soups chili with beans and beef,11,g,35,mg,980,g,27,g,20,g,5,g,0,g,8,g,8,g
506,jreck subs,soups cream of broccoli with cheese,15,g,20,mg,1320,g,21,g,8,g,3,g,0,g,4,g,7,g
507,jreck subs,soups cream of potato,12,g,5,mg,1010,g,31,g,7,g,2,g,0,g,3,g,9,g
508,jreck subs,soups french onion,4,g,0,mg,1080,g,13,g,2,g,1,g,0,g,1,g,7,g
509,jreck subs,soups italian wedding,5,g,15,mg,1170,g,22,g,9,g,2,g,0,g,1,g,1,g
510,jreck subs,soups minestrone,3,g,0,mg,1140,g,18,g,5,g,0,g,0,g,5,g,5,g
511,jreck subs,soups new england clam chowder,4,g,35,mg,990,g,36,g,9,g,3,g,0,g,3,g,7,g
512,jreck subs,soups split pea with ham,2,g,10,mg,1440,g,34,g,13,g,0,g,0,g,10,g,2,g
513,jreck subs,soups tomato basile with cheese ravioli,1,g,15,mg,1010,g,31,g,6,g,0,g,0,g,1,g,7,g
514,jreck subs,soups vegetable beef,2,g,10,mg,1280,g,20,g,6,g,1,g,0,g,3,g,5,g
515,jreck subs,soups vegetable beef with barley,3,g,15,mg,1210,g,18,g,7,g,1,g,0,g,5,g,4,g
516,jreck subs,sour cream and chive fries,17,g,0,mg,650,g,33,g,3,g,2,g,0,g,3,g,0,g
517,jreck subs,spinach and herb half sub,2,g,0,mg,490,g,40,g,8,g,1,g,0,g,2,g,3,g
518,jreck subs,sun chips multi grain garden salsa chips,9,g,0,mg,230,g,27,g,3,g,2,g,0,g,3,g,3,g
519,jreck subs,sun chips multi grain harvest cheddar chips,9,g,0,mg,320,g,27,g,3,g,2,g,0,g,3,g,3,g
520,jreck subs,sun chips multi grain original,9,g,0,mg,180,g,27,g,3,g,2,g,0,g,5,g,3,g
521,jreck subs,sweet potato fries,12,g,0,mg,280,g,32,g,2,g,2,g,0,g,3,g,12,g
522,jreck subs,swiss cheese half sub,4,g,15,mg,30,g,0,g,4,g,3,g,0,g,0,g,0,g
523,jreck subs,tortilla wrap plain,9,g,0,mg,540,g,51,g,9,g,3,g,0,g,2,g,1,g
524,jreck subs,tortilla wrap spinach,8,g,0,mg,610,g,51,g,9,g,3,g,0,g,2,g,1,g
525,jreck subs,tortilla wrap sun dried tomato basil,8,g,0,mg,830,g,51,g,8,g,3,g,0,g,2,g,1,g
526,jreck subs,tortilla wrap whole wheat,9,g,0,mg,520,g,48,g,9,g,40,g,0,g,4,g,1,g
527,jreck subs,wheat roll half sub,4,g,5,mg,430,g,40,g,9,g,1,g,1,g,3,g,6,g
528,jreck subs,white roll half sub,2,g,0,mg,490,g,40,g,8,g,1,g,0,g,2,g,3,g
529,jreck subs,whole pickle,0,g,0,mg,1180,g,3,g,1,g,0,g,0,g,1,g,2,g
530,jreck subs,whole sub bbq pork rib with bbq sauce,50,g,130,mg,2350,g,122,g,40,g,16,g,0,g,6,g,40,g
531,jreck subs,whole sub bbq pulled pork with bbq sauce,14,g,85,mg,1870,g,104,g,42,g,6,g,0,g,6,g,26,g
532,jreck subs,whole sub blt bacon lettuce tomato mayo,48,g,65,mg,2480,g,94,g,32,g,16,g,0,g,4,g,10,g
533,jreck subs,whole sub breaded chicken hoagie,42,g,90,mg,2340,g,112,g,40,g,10,g,0,g,8,g,8,g
534,jreck subs,whole sub breaded clam strips clam roll,50,g,30,mg,2840,g,158,g,34,g,8,g,0,g,6,g,14,g
535,jreck subs,whole sub breaded eggplant parm,14,g,0,mg,2030,g,122,g,24,g,2,g,0,g,12,g,14,g
536,jreck subs,whole sub breaded veal parm,54,g,90,mg,2610,g,126,g,48,g,22,g,2,g,10,g,12,g
537,jreck subs,whole sub cheese burger sub lettuce tomato,40,g,160,mg,1340,g,84,g,62,g,16,g,2,g,4,g,10,g
538,jreck subs,whole sub cheese sub,24,g,40,mg,1710,g,90,g,28,g,14,g,0,g,4,g,12,g
539,jreck subs,whole sub chicken salad,70,g,110,mg,1420,g,88,g,34,g,14,g,0,g,4,g,12,g
540,jreck subs,whole sub chicken stir fry,6,g,75,mg,2030,g,84,g,48,g,2,g,0,g,4,g,6,g
541,jreck subs,whole sub cooked salami,26,g,80,mg,2090,g,90,g,28,g,10,g,0,g,4,g,12,g
542,jreck subs,whole sub corned beef rueben swiss russian,26,g,30,mg,2170,g,94,g,40,g,8,g,0,g,8,g,12,g
543,jreck subs,whole sub croghan bologna,16,g,85,mg,1760,g,90,g,34,g,8,g,0,g,4,g,12,g
544,jreck subs,whole sub deli corned beef,8,g,5,mg,1620,g,88,g,38,g,4,g,0,g,4,g,12,g
545,jreck subs,whole sub deli ham,8,g,60,mg,2320,g,90,g,34,g,4,g,0,g,4,g,16,g
546,jreck subs,whole sub deli roast beef,8,g,50,mg,2010,g,86,g,36,g,4,g,0,g,4,g,12,g
547,jreck subs,whole sub deli turkey,6,g,40,mg,1870,g,88,g,34,g,2,g,0,g,4,g,12,g
548,jreck subs,whole sub egg salad,50,g,525,mg,1310,g,88,g,18,g,12,g,0,g,4,g,14,g
549,jreck subs,whole sub fish battered pollock,28,g,70,mg,1720,g,110,g,34,g,6,g,0,g,4,g,6,g
550,jreck subs,whole sub grilled chicken,14,g,100,mg,2040,g,86,g,44,g,6,g,0,g,8,g,10,g
551,jreck subs,whole sub hard salami,40,g,90,mg,2600,g,86,g,38,g,18,g,0,g,4,g,12,g
552,jreck subs,whole sub hot ham capicola,8,g,35,mg,1950,g,94,g,30,g,4,g,0,g,4,g,18,g
553,jreck subs,whole sub italian sub,36,g,85,mg,2690,g,90,g,40,g,16,g,0,g,4,g,16,g
554,jreck subs,whole sub meatball,36,g,95,mg,2260,g,94,g,46,g,14,g,2,g,8,g,10,g
555,jreck subs,whole sub pizza sub,42,g,90,mg,2910,g,90,g,40,g,18,g,0,g,6,g,14,g
556,jreck subs,whole sub popcorn chicken,38,g,50,mg,2420,g,112,g,48,g,8,g,0,g,8,g,8,g
557,jreck subs,whole sub regular sub,24,g,70,mg,2170,g,88,g,30,g,8,g,0,g,4,g,14,g
558,jreck subs,whole sub sandwich pepperoni,42,g,90,mg,2670,g,90,g,38,g,18,g,0,g,4,g,16,g
559,jreck subs,whole sub sausage and peppers,74,g,155,mg,3210,g,108,g,44,g,24,g,0,g,4,g,20,g
560,jreck subs,whole sub seafood salad,58,g,50,mg,2170,g,108,g,24,g,12,g,0,g,4,g,18,g
561,jreck subs,whole sub steak and cheese,22,g,70,mg,1400,g,84,g,40,g,10,g,0,g,4,g,6,g
562,jreck subs,whole sub super steak and cheese,48,g,160,mg,2040,g,88,g,70,g,22,g,0,g,4,g,6,g
563,jreck subs,whole sub tuna salad,74,g,90,mg,1620,g,86,g,34,g,14,g,0,g,4,g,12,g
564,jreck subs,whole sub vegetarian,14,g,20,mg,1350,g,88,g,22,g,8,g,0,g,4,g,12,g
565,jreck subs,zucchini sticks battered,19,g,0,mg,1050,g,35,g,3,g,2,g,0,g,2,g,2,g
